business_id	text
mLwM-h2YhXl2NCgdS84_Bw	Great soul food period , it's get no better, come and get it. They have lamb too !! Chicken, ribs, bbq chicken and sides to boot !! Pure awesomeness !!
mLwM-h2YhXl2NCgdS84_Bw	South Florida resides on the east side of Charlotte inside of a convenience store....a little sketchy but the food is really good.  They serve breakfast all day(chicken and waffles, fish and grits, etc) lunch and dinner.  They are grilling chicken, ribs, and pork chops right in the parking lot and although I haven't tried the ribs, the grilled pork chops and chicken are perfectly cooked.  I also tried the fried chicken, green beans, lima beans, potato salad, stewed squash, and seafood salad...all excellent!  The only thing I wasn't impressed with was the Mac n cheese.  They also offer homemade desserts, fruit and salad.  Great addition to the soul food scene!
mLwM-h2YhXl2NCgdS84_Bw	So this place is in the c-store. A little skeptical of the atmosphere but go in the day time and it's alright.  My food was good . I had turkey wings yams and green beans.  Very good turkey wings. Yams were not to sweet just the way I like it.  Will try again.  Sometimes taking a chance works!
mLwM-h2YhXl2NCgdS84_Bw	Amazing food!! I can't believe it almost taste like my 100 year old grandfathers food, God rest his soul. Even though these guys are displaced and have opened up shop in Nubian Queens Restaurant, they did not let that come across in the food  they prepared! I'm a patron from here on out!
DiA78qPtp6rfRNdomzjBbw	All your essential Filipino needs in a little store on the borderline of Henderson.\n\nNo fresh fish or meat. Although, they keep a good variety frozen towards the back of the store. \nI love how they always have pork belly when I need to get my chef on!\n\nRecently just opened a restaurant a couple months ago. Pretty much just took over another suite and slapped a door in between the two. \nFood looks amazing though so I'll have to try it out next time.
DiA78qPtp6rfRNdomzjBbw	It's a grocery store with all the filipino grocery items all packed into this tiny place.  Very clean, organized, and the place  didnt have any overpowering fishy aroma like other places Ive been to. The prices are a little higher though, but I still save $$ on gas an save time going to the places on Maryland. Glad I stumbled upon it since its closer to where I live. Good thing since I love halo halo I have a place to run to nearby that has all the ingredients for it!
DiA78qPtp6rfRNdomzjBbw	Small, convenient, Filipino store on the east side of town! \n\nLots of ingredients, canned goods, fresh and frozen produce, snacks, and baked goods to choose from! \n\nFairly clean and organized, helpful and friendly staff! \n\nThey also have phone cards and offer a balikbayan (big box of goods to be sent to the PI) service!
DiA78qPtp6rfRNdomzjBbw	Love that this store is in my neighborhood. It's a quick drive from my house and alleviates me from having to drive all the way to Seafood City. The prices are reasonable too! \n\nThe staff is super nice and always helpful. Thank you!
DiA78qPtp6rfRNdomzjBbw	This is a small, but full Asian store! It's got all the basics and it is about 5 minutes from my home. It's great for when I need something that can't be found at the usual grocery store. Their prices are also very good, some of the best in town for Asian goods. I still need to go to some of the bugger stores for more specific items, but for its location, good prices, and well-stocked shelves, it is a store I keep returning to.
DiA78qPtp6rfRNdomzjBbw	Just got back and it's a nice little store. I never look to my right when driving on Boulder, but I guess I had time to look this time. I spotted something filipino and drove in. Nice little shop. It feels like everything barely fits inside but it works. I took pictures of things I wouldn't see at seafood city. I found these cheese cake kit kats that I have only seen in Japan. I haven't even seen them in any Japanese markets here. \n\nDidn't try the food next door though. Overall nice little selection you can't find at Seafood city. Good experience. I don't expect customer service here though its just a small store.
DiA78qPtp6rfRNdomzjBbw	Convenient for people who are too far away from Seafood City and live near the area.
DiA78qPtp6rfRNdomzjBbw	We come to this store often solely because it's close to home, so it's really convenient. Joshan's has all of the essential Asian and/or Filipino items that you may or may not have forgotten to pick up while you were at the always busy Seafood City. It's a small store with narrow aisles, but everything is there if you take the time to look.\n\nThey carry fresh vegetables, noodles, sauces, seasonings, etc. Joshan's also sells my favorite Magnolia ice creams as well as a bunch of Asian chips and snacks that remind me of my childhood. There is just a good assortment of everything. During my last visit, I also discovered that they carry a few products from Hawai'i. I've always known that they sell a variety of the Hawaiian Sun drinks, but it was just brought to my attention that they also have things like Zippy's famous chili! What! Oh, how I miss my Hawai'i!\n\nOverall, a good place to shop for what you need if you're in the area! The prices are decent, but just a reminder that there is a $10 minimum for credit/debit. If you don't plan on spending $10, have some cash on hand!
DiA78qPtp6rfRNdomzjBbw	I've been going to this mini mart since they began. Over time I've seen how they began and grew so is the rise and fall of their customer service. It seems the more bigger they get the more they treat loyal customers like piece of ****!\n\nI always buy tons of stuff here and one of them is the Veggie Egg Rolls but they always try to be stingy on the dipping sauce. Come on now? Really? After supporting you throughout these years? \n\nIt's okay for immediate needs or convenience stops but if you want total customer service and satisfaction you won't find it here.
DiA78qPtp6rfRNdomzjBbw	We love having this little store close to our house. From rice to fresh veggies, to balut and salted eggs, they have a lot of goodies.\nLots of Filipino products, great prices.
DiA78qPtp6rfRNdomzjBbw	Not my first choice when it comes to asian markets but it is in my neighborhood and easy to get to for those on the east side/hendo side of town.\n\nThe store is small and when walking through with my hunny and child, it can be a little cramped. \n\nHowever, what I do love about this place is that they definitely have what I need, when I need it. You will find your filipino staples here with absolutely no problem. So if you are in need of a few items to pick up, then this is definitely the place to go.\n\nAlso depending on the day, they have an assortment of warm/hot food to choose from. These have been surprisingly good.
DiA78qPtp6rfRNdomzjBbw	Cute little market off of Russell & Boulder Hwy. It's   a little tight inside. Very difficult to maneuver from isle to isle. I did find an organic all natural coconut water in the small refrigerator towards the back of the store, some tamarind candy, and plenty of soup mixes. When I got to the counter, the young girl doesn't even acknowledge your presence. No hello, hi, how are you?....nothing! She looked down then began to ring up my items. It was a little awkward. Note to the owner, teach this young lady some mannerism in customer service. Always greet every person that walks into your establishment. Greeting your customers goes a long way. Needless to say, I will not return. \nI went next door shortly to check out their new restaurant, but the food was just swimming in fat and the smell was not appetizing. I was hoping to try out some of the food? :( \nI'll continue to go to the new Mabuhay Market next to Sunset Station, it's so much cleaner and bigger. And yes the owners greet you. :)
DiA78qPtp6rfRNdomzjBbw	A little oasis of pinoy/Filipino culture on the edge of town. \n\nThey have: fresh noodles, fresh vegetables, herbs, frozen meats, juices [Guayabano, Calamansi, Mogu Mogu, coconut juice, etc], spice packs, lumpia, shumai, BBQ chicken & pork skewers, sausages [frozen & dried], purses, beauty products & soaps, magazines, snacks [cookies, coconut fruit jellies, chips, peanuts]  and more. It's a small space but they pack a lot of items in, with much of the fish and meat available in opaque coolers. It's worth digging! A package of pork belly chunks for under $2 in this neighborhood is a nice find. They also have various types of Pinoy bbq that look awesome, but I have not tried yet. Their peanuts are great, though!    \n\nI admit, the vegetables sometimes have an off day. But it's not often, and what's available can be hard to find on this side of town! The selection of vegetables alone makes it worth going; lots of fresh herbs, bitter melon and various other yummies.\n\n+ Hello Panda cookies. The boy was very happy to find them on the shelves there. :} The little cookies have crisp outer shells with cute panda characters printed on them and creamy insides with various flavors. I've had them before and loved them. \n+ Coconut fruit jellies! Reminds me of shopping at a Korean grocery when I was really young and stocking up something like these :] They're juicy, chewy little jellies in portable cups. They  can be a little messy, but they're refreshing and fun! And really low in calories for a sweet treat, so it's a nice thing to pack in your work-day lunch for a little sweetness.  \n\nIt's a useful little store in a shopping center with a circle K, Not as impressive as a store in china town, but it's a respectable little operation on this side of town!
DiA78qPtp6rfRNdomzjBbw	Reading the prior reviews, they are pretty accurate as to how small this store is layout wise, and how tight the aisles are. I came in to get a Kalbi korean BBQ marinade, and they had a good selection including one that I like to use. They have a few items in a freezer like pre-made lumpia as well as others. The store actually looks like they carry quite a bit in that small space.\n\nI'll be back to shop again. Friendly people working the counter.
DiA78qPtp6rfRNdomzjBbw	Very small, but packed full of staples. There is also a small produce section which looks pretty clean but I never bought anything from there before. I don't see any fresh fish or meat. All frozen.\n\nEvery weekend, come early for their fresh vegetable and beef rolls. Delicious and runs out very quickly! I almost had to punch an old Filipino lady to get my fix! \n\nRight next door to a delicious Filipino restaurant.
DiA78qPtp6rfRNdomzjBbw	Okay. What a trip.\n\nSo, I copied and paste the address from Yelp into my GPS, and was taken on a wild goose chase. Had me behind the silverbowl, cutting through neighborhoods, all kinds of crap.\n\nIt is in the circle K parking lot, however, it is behind all that. It is closer to the Roberto's and the salon/check cashing place.\n\nTight squeeze doesn't even begin to describe how small the isles are here. An employee was stalking the shelves, and her and I could barely squeeze by one another to fit. The shelves are crammed with items, and pricing is hard to figure out, because there is just so many things. \n\nI found the boba that I was looking for (a quick boil, that takes 5 minutes to make). I grabbed a few bags of those, but their debit/credit card policy is $10 or get charged a fee. \n\nLuckily, I found a sweet roll that my daughter really loves. No one really acknowledged me, kind of lame... IF you can manage the tight squeeze, and you know exactly what you want, and where it is, you shouldn't have a problem.
DiA78qPtp6rfRNdomzjBbw	With this little Asian market being so close to home who needs to drive all the way to Seafood City .Unless im in the mood for Jollibee but thats a different story ;). Most of your Filipino and Asian staples crammed in this little store . Yes  little. Usually never a crowd so its not a big deal for me because if it was I'd be a little uncomforatble bumping uglies with strangers , the aisles are that narrow . Like I said its usually never bursting with traffic so its not a problem . All kinds of goodies including snacks , sauces , fresh produce and frozen goodies like meats ice cream and mochi ! Yum mochi , great i want some mango mochi maybe ill go get some :)
aBGT2NQ9fSesoB93-eVj5w	Decent location in what I would consider the not so fabulous section of Mesa. The lady at the counter was super friendly and I was in and out in no time with my $.69 Gatorade Peace A town, I'm out of here!
aBGT2NQ9fSesoB93-eVj5w	Worst pharmacy ever. I have been here multiple times (I thought maybe they were just having an off day). The people that work in the pharmacy (with the exception of 1 or 2 employees) are rude and unprofessional. One lady always has a toothpick in her mouth, ew. Two different employees, on two different visits, have completely ignored me while I was talking to them. \n\nOn today's visit, I was told the prescription would be ready in 20-30 minutes. I arrived an hour and 10 minutes later and it wasn't ready, no apology they wouldn't even an acknowledgement that they were running behind....nothing. \n\nThe pharmacist, Phil I believe, was nice today and looked into getting me a different brand because the price was so high on what was prescribed by the dr but I had to argue with the other lady forever to get her to take the time to ask the pharmacist. \n\nOn a previous visit, they quoted me 2 hours for a bottle of cough syrup that was already filled (so all they had to do was put a sticker on the bottle) and there wasn't a single person waiting in the store for their prescriptions. They guy that night was also extremely rude. \n\nI wish these people would remember that not everyone is coming in for their meds that they take on a daily basis....many people are coming in because they are sick and feel like crap....treat people with some kindness and respect!!!!
aBGT2NQ9fSesoB93-eVj5w	This is not a place to go for your prescriptions.  I was in line and waiting to get my prescriptions and it was a long line, mind you.  While in line a woman who could not speak english came up to me had to have her daughter translate her spanish.  She tells me her mom was in front of me but sat down so she was going to stand in front of me.  She was nowhere in sight while I was in line.  I explained I had been STANDING in line for 15 minutes and she could go to the end of the line like everyone else.  When it was my turn to head to the check out (after about 20-30 minutes of waiting to PICK UP a prescription that was ALREADY READY, the pharmacy tech called this woman in Spanish and said something to her and she went in front of me.  Not only have I been a Walgreens customer for my prescriptions since 1992, I am now taking my business and prescriptions elsewhere.  Terribly long lines and blatant disregard for visibly injured customers on crutches standing in line.  BYE WALGREENS,
aBGT2NQ9fSesoB93-eVj5w	I'm visiting Mesa from Denver and I'm burning up. Craving cold ice tea I came to Walgreens.  Bought it. And left feeling accomplished
aBGT2NQ9fSesoB93-eVj5w	I cannot believe that there are so many negative reviews here. It seems ludicrous compared to my experience with the healthcare clinic.\n\nI made an appointment online for 2PM, and the NP saw me on time so I didn't have to wait around forever. I don't think I was there longer than 20 minutes. The NP (his name was Guy!) was quick and attentive. He was very kind and personable, and he got me the right prescription and sent me on my way.\n\nThe pharmacy staff as well as the store staff were also very pleasant. The store was clean and well stocked and I had no issues whatsoever.\n\nOne of the NPs even called me a few days later to make sure everything was good. I've been to Walgreen healthcare centers plenty of times for various reasons and that had never happened before.\n\nThis store was the only one with appointments open, which is why I picked it even though it is on the other side of town from where I work and live. From now on this will be my primary Walgreens healthcare center!
aBGT2NQ9fSesoB93-eVj5w	Totally disagree with the negative reviews of this place. I actually had my prescriptions transferred here because it's close to my work and the pharmacy department has such better customer service than the Walgreens by my house.
aBGT2NQ9fSesoB93-eVj5w	Moved across town and needed refills.  The pharmacist was crabby and also told me I could only transfer 5 prescriptions (I moved from Gilbert to Mesa).  I had only transferred 3 at this point and they wouldn't help me at all.   They said it was a "Walgreen's Policy" which I know is not right.    Now I am having to drive over to Gilbert to obtain my refills.  \n\nDisgusting and disappointing, will definitely go elsewhere.
aBGT2NQ9fSesoB93-eVj5w	Went there today looking for some new Wet n Wild eyeshadow quads which they didn't have in yet.  Thought, hey I wonder if they have any NYX products.  So, I asked the employee who'd been following me and watching me like a hawk since I got into the cosmetics department -middle aged caucasian brunette - and she narrowed her eyes at me and said "no, that's dollar store stuff!" then smirked.  WTF..can the attitude lady.  They sell it at Ulta and Target..although not high-end, it's not dollar store.  Incidentally that was a yes or no question.  What a great way to start my birthday..with an embittered racist minimum wage employee.  Won't be shopping here in the future; though I live nearby.
aBGT2NQ9fSesoB93-eVj5w	This pharmacy is the absolute worst .. Do yourself a favor and take your prescriptions elsewhere
aBGT2NQ9fSesoB93-eVj5w	Walgreens is Walgreens.  This location is a bit sketchy depending on the time of day you go.   I have had people ask me for money outside and the parking lot is always very busy.  However, the staff is way helpful!  I was looking for travel size contact solution.  They pointed me in the right direction then had someone check on me to make sure that I found what I needed.  Good thing too because I would have left not seeing it.   I even got rung up in the cosmetic isle!
aBGT2NQ9fSesoB93-eVj5w	The pharmacy here is a joke. .. I have had several occasions of bad service here on top of one very rude pharmacist. ..Go across the street and save yourself the headache!
aBGT2NQ9fSesoB93-eVj5w	Don't go for you medications.. They tell you one time take twice as long as they say and you get to watch all the people that come in after you leave with their prescriptions when they wait also.  Walmart or frys is a much better option.  I've been useing Walgreen's for a long time and have been messing up lately. Very unpleasant experience.  The need to fix whatever they broke in November when problems started
aBGT2NQ9fSesoB93-eVj5w	This is a pretty standard Walgreens.  They have a pretty decent selection, its a bit bigger than the one by my house.  The guy that checked me out was pretty friendly.
jCvnGFx3nWX51OkDW8mSsg	Whatever you do, don't get the honey garlic meatball keabs. Nor the sweet chili ones. Nor those spicy chicken taquitos. I know your belly's growling and you could eat almost anything man but TRUST me, you're gonna regret it.\n\nThe Big Gulp, tho? GO FOR IT!
jCvnGFx3nWX51OkDW8mSsg	Huge selection of hangover foods, parking spots and a sneaky post office I'm forced to go to often. Slushies on tap. Taquitos. You know the drill.
jCvnGFx3nWX51OkDW8mSsg	Why have the prices for the individual sour candies gone up? 0.35 cents for 1 sour key..seriously guys? 0.10 cents for a mini sour key? This was disappointing to see. Everything else is overpriced as well..go down the street to the dollarama if you are desperate for chips, chocolate or candy. \n\n7 Eleven is the only place I go for a last minute lottary ticket and that is about it. The food is crappy, the junk food is overpriced and the fountain drinks/slushies just aren't what they used to be 10 years ago.
1N6_FgS6nq5eT_3x4MXm4A	Really great ice cubes made from Reverse Osmosis water.  Super nice guy bought the place and it is already better.  There is even Thrifty ice cream which I will try next time I'm in.  This location used to be randomly open, now it is a real business you can count on!
1N6_FgS6nq5eT_3x4MXm4A	I used to go to this place for snow cones and ice cream when I was a little girl. Lived in the same house my whole life (right across the street from this establishment) and one day I guess a new owner came in and ruined this place and gave it a bad rep. I stopped going. Rude staff. Nasty and dirty I wouldn't even walk in there if I was thirsty. But NOW. I don't know the name of the owner but this place is BACK! SO CLEAN. Organized. SHAVED ICE! BOBA! ICE CREAM! IT'S THE BEST SHAVED ICE YOU CAN GET! The flavors. HAND. MADE. That's all you need to know to come in. I come here multiple times a week now! Do not hesitate to come in and cool off here!
1N6_FgS6nq5eT_3x4MXm4A	The best customer service topped off with amazing clean ice,  none of that white resin at the bottom of your glass like grocery store ice.
1N6_FgS6nq5eT_3x4MXm4A	If you drink gallons of water like my family does, you have to pick up a free standing water cooler and fill up here $.00.25 per gallon and ice is the best for daily or any occasion.\nCheaper than Fry's or any convenience store.\nThe staff at 43rd Ave and Cactus and 35th Ave and Northern are always friendly both have carts, saves on back pain.
sTfs8QwqzcgTe9GFz99FGQ	Love this wine store.\nStopped in for a wine tasting on a Friday night a while back and have been coming back ever since.  \nWine tasting selections are always good and the staff is always friendly and helpful in selecting the perfect wine for any occasion.
sTfs8QwqzcgTe9GFz99FGQ	I'd heard of the Wine Cellar, but never stopped in before because it's a little outside my regular commute. I was picking up dinner next door last night and finally had the pleasure. It's a relatively small space, so I can't compare with other places I've shopped, but the selection seems great.\n\nI had an idea of what I was looking for, but didn't see it. I ended up speaking with the owner for a while about hard ciders and loved learning that they refuse to stock any varieties that don't disclose where they get their fruit. That's a big plus in my book. He also offered to order something specific if I knew I wanted multiples - a great thing to keep in mind for those times when we can manage to stock up. He was so pleasant and knowledgeable that I'll be making a point of adjusting my routes through Verona to add the Wine Cellar to our errand trips. \n\nAs I've said so many times in my reviews, I feel small business is the way to go. I'll go out of my way to support a spot that offers this kind of service every time.
sTfs8QwqzcgTe9GFz99FGQ	This wine shop is small in size but vast in character. Rick can tell you a lot about each wine without any pressure to buy a certain bottle. There's no pretension and few mass produced labels. A great independent small town shop to support!
sTfs8QwqzcgTe9GFz99FGQ	The best place to buy wine in the Madison Area. Super friendly staff and wine you won't find anywhere else.
sTfs8QwqzcgTe9GFz99FGQ	Since discovering the Papa Murphy's literally right next door to the Verona Wine Cellar, my husband and I have talked about stopping in. We finally took the leap last night while picking up a pizza. \n\nThe place is small, but well laid out and very well stocked. We found items here that we've had trouble finding in Madison. We're big fans of Lakefront Brewing and of the Moscow Mule. Verona Wine Cellar was able to help us make the best drinks with our recent passions in mind. We found multiple bottles of Roarin' Dans Maple Rum from Lakefront Brewing (usually we can only find 1 bottle at Steve's) and it came with directions to make the most delicious drink - The Mooncusser. I also managed to find a 4-pack of Crabbie's Alcoholic Ginger beer. A beer I've only been able to find at Ha Long Bay on the East side. Most ginger beers that are found in grocery or liquor stores are non-alcoholic and very sharp in ginger taste. Crabbies is smooth and much more like a soothing combination of ginger ale and beer. Plus, adding vodka and a lime makes for a very potent Moscow Mule.\n\nNeedless to say, we'll be stopping in again!
sTfs8QwqzcgTe9GFz99FGQ	Such a fun place.  A large selection of wines, beers, non-alcoholic beers/wines, mixers and a small selection of Hard-A.  Free wine tastings on Friday at 4 and beer tastings every third Thursday.  \n\nThe guy working was awesome.  Had a great sense of humor and very willing to help me.  I am very indecisive so I just had to take everything in at first but he threw out a few suggestions.  I ended up with a pumpkin ale by Smuttynose and a coffee stout and I can't remember who made that one.  But it has coffee and that is all I care about.  \n\nThey did have a lot of local beers, Ale Asylum, Lakefront, the usual.  I was impressed with their Rogue selection, a favorite of mine.  I would go back just to explore.
sTfs8QwqzcgTe9GFz99FGQ	This place is seriously amazing. Great selection WONDERFUL and knowledgeable service. Love stopping in here.
A8y3yc_-_cDrHiApqJlx-w	I originally gave them two stars but since then they lost another RX and had no answer when asked what took so long to fill it. This place needs some training on business practice.
A8y3yc_-_cDrHiApqJlx-w	Last time using this stinking pharmacy.  Always take longer than they say, never enough staff. I am writing this now listening to my young child cough repeatedly because this useless location couldn't get her prescription ready since NOON YESTERDAY. the had ALL DAY to get it done. Now I have to call this morning when they open to see if someone could maybe do their job.\n\nNEVER AGAIN!
