business_id	text
WRlcASYWlNYmMr9lHOYw1Q	This is my boyfriend's favorite deli and he has been going for quite some time. He used to live down the street and that is how he got familiar with this place. We don't live too far but don't frequent this place that often. \n\nLet me start with this - my boyfriend is from the east coast where they grew up eating hoagies. I grew up eating rice and all sorts of weird things. I wouldn't say I'm a sandwich/sub/hoagie connoisseur of any sorts but he is. The bread plays a major factor. This place does it right! \n\nIf you are in the neighborhood and you're in the mood for a quick/easy and delicious hoagie, this is your place. Bye, their macaroni salad is pretty good too!
WRlcASYWlNYmMr9lHOYw1Q	Really love this store. Marty always greets me and my friends with a smile, and then hooks us up with some quality sandwiches. The sandwiches are fantastic, made quick, and the best part is the price of the sandwich combo which includes a bag of chips and a drink. The store also hires local students so it's nice to see familiar faces and catch up with them while my sandwich is being made. It's in such a great location too that it' never a hassle to go here for some food. I fully recommend this place to anybody who lives in Scottsdale, and even anyone just passing through town looking for a quick sandwich.
WRlcASYWlNYmMr9lHOYw1Q	Love their ham and cheese sandwiches! We love stopping by for a quick lunch to go! YUMMY!!
WRlcASYWlNYmMr9lHOYw1Q	Was in the area and came across this little deli.  I had the deluxe sandwich and it was done perfectly. The bread was super fresh and they put in tons of meats and cheese. I thought the price was very reasonable. If I lived closer this would definitely be my go to sandwich deli.
WRlcASYWlNYmMr9lHOYw1Q	May offer some of the best subs in town...fresh and delicious! Love their sub rolls, they were soft but had a nice crust. Very clean and well organized, you can tell they care about their business. Super nice & friendly people working behind the counters & making the sandwiches...the folks working seemed like family and you could tell they care about the business & product. Pretty refreshing to find a place like this nowadays! I wish I lived in this neighborhood...I'd eat & shop there everyday!
WRlcASYWlNYmMr9lHOYw1Q	I've been coming to this place for years and no matter how many sandwich shops pop up in the valley, I still always say that convenient corner makes the best sandwiches I have had. The boar's head meat is fantastic, the bread is delicious, everyone who works here is so incredibly friendly, and it's tucked away in a neighborhood so you don't get the annoying foot traffic or loud morons talking on their cell phones. Just an excellent sandwich. I'll be singing this place's praises for years to come.
SUV2tu5mfQz7Xa9C2pb6Pg	The staff is friendly and there are some good deals at times. \n\nThe pharmacy is a little confusing, the staff in there doesn't seem to communicate well. I switched to a different birth control and they kept giving me the old perscription too until I pointed it out.\n\nRegular walgreens, has most everything you would want/need from a convenience store.
SUV2tu5mfQz7Xa9C2pb6Pg	Literally the worst Walgreens I've ever dealt with. Pharmacy staff is ever-changing and consistently lazy. I've seen some pretty ridiculous interactions between  the pharmacists/techs and some shady people due to the area so I can somewhat understand them being a bit jaded, but that doesn't excuse their performance especially when it comes to us normal people who just happen to live close by and want to use a Walgreens for our prescriptions. I am looking into switching to CVS today.
SUV2tu5mfQz7Xa9C2pb6Pg	CVS is so much better when it comes to filling prescriptions. This place takes longer. And they forget about you. CVS will call out your name, here its "Oh you are still waiting?" :-|\n\n\nPros - the app is great, Walgreens photo is amazing and helps my scrap bookign needs!\nAnd it has all of my girly necessities, from make up to shampoo, to lotion. Awesome.
SUV2tu5mfQz7Xa9C2pb6Pg	EXCELLENT CUSTOMER SERVICE HERE! I've used the pharmacy (drive through at night) and store during the day and both were excellent experiences. By accident I left an item behind in the store after a purchase and the employees, especially the manager and assistant managers, were all VERY helpful in keeping it safe for me until I was able to retrieve it.
SUV2tu5mfQz7Xa9C2pb6Pg	I use this Walgreens solely for prescriptions, but I'm officially on the hunt for another pharmacy or switching to mail order.\n\nI don't find the staff particularly friendly at this location or particularly helpful. I had a problem with my insurance accepting my prescription once, and they didn't bother to tell me until I got there. \n\nBy far the worst part is the wait time. The drive thru is consistently a ridiculous wait. Out of the 8 times I've gone, only once did I wait less than 10 minutes. If you can't staff enough people to cover the drive thru, then just don't have one! Last night, I was the only car in the drive thru. The pharmacist said he would be with me in a few minutes. 10 minutes later, I was still waiting with no further or update or acknowledgement. I finally gave up and left and now have to make a second trip tonight.\n\nGoing inside doesn't really make it that much faster either. It's really a choice of do you want to wait in your car or stand in line in the store?
SUV2tu5mfQz7Xa9C2pb6Pg	Its a drug store. It serves its purpose.
SUV2tu5mfQz7Xa9C2pb6Pg	Very friendly staff that is always happy and willing to assist with any needs. Every time I visit as a frequent customer I'm treated with respect and kindness.
SUV2tu5mfQz7Xa9C2pb6Pg	They hired this new guy at the front register and good god I would drive 10 miles out of my way to not get this guy. He calls the manager over the speaker every 2 minutes, has no knowledge of anything can't count change to save his life and he's a rude douche bag I have no idea why anyone could ever hire this guy. He will hold up a line for a good 20 minutes to get through 3 people so save yourself time and go to another Walgreens!
SUV2tu5mfQz7Xa9C2pb6Pg	I go here to get my prescriptions filled and also to shop for cosmetics and stuff occasionally.  I've never had a problem with the pharmacy.  The drive thru line can take a while at times, so I try to go during the off-peak hours.  When I don't have to wait for other people in line I can drive up, get my prescription, and be done in less than 5 minutes.\n\nand sometimes they have treats for my dog!
SUV2tu5mfQz7Xa9C2pb6Pg	5 STARS FOR CONVENIENT LOCATION & POLITE REGULAR STAFF. \n\n0 STARS FOR CRAP PHARMACY SERVICE & THEIR "ATTENTION" TO DETAIL\n\n* I have used this location for  3 y and 4 mos, but will never return\n* Since switching medication a yr ago, I've encountered many problems & delays\n* In late June, my doc wrote a Rx for 90 pills of an extended release pill\n* I picked up my Rx & brought it home only to realize it was not extended release\n* I phoned WGs and they said my doc didn't write it for extended release\n* I phoned my doctor on Friday 30 June but she doesn't work Fridays\n* So, I left an urgent Vmail with her nurse in order to obtain an extended release Rx\n* 3 hours later, WGs sent me an automated telephone call stating my Rx was ready\n* I returned & exchanged the 90 regular pills for extended release\n* 1 hour later, the nurse phoned & I told her it had already been taken care of\n* 3 days later, I open the bag only to realize that the new bottle of extended release has      \n        only 30 pills--not 90 pills\n* My (old) insurance ran out on Friday 30 June b/c I lost my job; WGs won't replace my 60\n        missing pills\n* My new insurance's co-pay for the SAME extended release 30 pills is $1,000 instead of $12\n*So, I now must purchase regular release pills, which doesn't work as well\n* I hate this pharmacy & will use Fry's, CVS, or Walmart from this point forward b/c I want \n        out of their system\n\nAs I try to better my life, this WGs pharmacy repeatedly makes it more difficult to do so. \n\nAdios!
SUV2tu5mfQz7Xa9C2pb6Pg	The evening shift pharmacy manager is a jerk. They only had a partial quantity of my prescription available so he gave that to me and told me to come back when I was ready for the rest. I came back a week and a half later and he told me that I had to pay my extremely high co-pay again because I waited too long to come back. I told him that there was no time frame given or I would've come back for the rest already. He argued with me and said that he had informed me of that (LIAR!!!!!). \n\nHe refused to override the charge for a prescription that I'd already paid for. He told me if I had a problem I could call 1800-Walgreens. I did just that. I spoke with someone in customer service who said that someone would contact me within 48 hours. I received a call the next day saying that my prescription was ready and the fee was being waived. Jerk.
SUV2tu5mfQz7Xa9C2pb6Pg	Patrick is a D bag. Couldn't have been more rude, and we come here all the time. Absolutely brutal customer service
SUV2tu5mfQz7Xa9C2pb6Pg	I've been filling my scripts here for almost three years and Chris always goes above and beyond to make the process as easy as possible and answer any questions. Sometimes the wait for the drive-thru takes awhile, but you can't always have it all.
SUV2tu5mfQz7Xa9C2pb6Pg	Standard Walgreens minus the slowest drive-thru pharmacy ever and the amount of beggars you'll encounter.
SUV2tu5mfQz7Xa9C2pb6Pg	The pharmacy here is very incompetent, and I have run into countless problems here that I have never experienced at another Walgreen's or any other pharmacy.  Every time I have a prescription filled or transferred, they make a colossal mistake.  Today was for sure my last time using them (or TRYING to use them).  I do not recommend going here, especially with so many other options nearby.
SUV2tu5mfQz7Xa9C2pb6Pg	Most helpful and friendly pharmacy staff that I've ever encountered. The drive thru can be slow, and watch out for Boxcar Willie out in the parking lot.
SUV2tu5mfQz7Xa9C2pb6Pg	Run from this place.  I have Walgreens for years. No more. The prescriptions are not filled when promised. They lost one that took me forever to get.  Scary situation. How well are you prescriptions being properly filled if they can't the paper work right.  Horrible place.
x9NBDLv7hvpQ1mD43BfRMQ	I've been shopping at this store a few times. I entered the store and when walking in the female cashier greeted with a big smile. I did my shopping the store had everything I needed I then went to check out the cashier by the name of Yolanda greeted me again. she was very friendly I didn't have a wellness card she helped me sign up very quickly explained all the perks etc. this was a good shopping experience. they need more people like her around the store.
x9NBDLv7hvpQ1mD43BfRMQ	My husband and I live very near this store and stop in frequently for prescriptions and various health and beauty needs. Until today. I was purchasing $50 worth of gift cards and being rung up by an employee named Linda. She let me know as she begin ringing me up that gift cards could only be purchased using cash or debit. I told her that was no problem because I was using my debit card to pay for them. I swiped my card and waited for the card reader to ask me debit or credit. Linda told me I needed to swipe my card again. She hit some buttons on the register and then walked away to talk to the person at the next register. I swiped my card again, and without further prompting, without it asking me debit or credit, or confirming the amount of the purchase, the transaction completed and a receipt popped out of the register. Linda suddenly came back over and snapped at me "You hit credit."\n\nI told her, "I'm sorry, but it actually didn't give me any option, and just ran right through." She said she'd have to return the cards and rerun the transaction, and I said that was fine. I apologized again because I'm polite, but told her again that I did not hit credit, because it didn't give me the option. She responded by ripping off the receipt and handing me my items and saying, "You hit credit. You're just too fast for me." I walked out of the store and then decided to go back to get her name to make a formal complaint later, and she was talking about me to the other employee in front of other customers.\n\nDrugstores like Rite-Aid are a dime a dozen, so spend your money somewhere where employees understand you're supposed to act like a normal person and not a disrespectful teenager at work.
x9NBDLv7hvpQ1mD43BfRMQ	I usually only run in to pick up an oddball item that HT doesn't carry. Not much into shopping at drugstores, I get my scripts from BiLo. I have noticed the staff is generally friendlier at Rite Aid compared to the Walgreens down he street. My only run in with any form of trouble was when an item rang up incorrectly, the cashier was quick to fix the issue.
pY-aLDz-FUOP9kg9f79a4A	Super little Asian grocery located on Franklin Blvd. in Gastonia. Family owned and run. Has decent selection of Asian food. Some produce, frozen foods, meat. Unhatched duck/chick eggs. Incense, candles, Asian supplements and beauty.  Friendly, helpful staff. \n\nNot bad for our little town.
pY-aLDz-FUOP9kg9f79a4A	Considering that Asian supermarkets are rare in the area, this is a pretty decent place to find traditional items (aka not American items). The only thing is that the shop is tiny and looks run-down. There is barely enough room for more than one person at a time to browse through an aisle. If it was a street, it'd be one lane only. The lights were all off in the fridges in the back, which made me hesitant to buy the veggies within the fridges. I originally didn't even think they had any choy because who would think to look in those dark storage areas??! The fridges are still fairly cold, but with the lights out, you would think the fridges aren't functioning properly! The cashiers up front seem friendly, prices are okay, limited selection, and I hate to use this term but for lack of a better word, this place looks ghetto. Regardless, it's still a good spot for Asian groceries if you're in the area.
pY-aLDz-FUOP9kg9f79a4A	Tucked away and a bit hard to find but, if you're looking for Asian -related groceries, make the trip to Gastonia. Needed 3 ingredients for a Filipino dessert. Found online for good prices but high shipping costs. Couldn't find in Charlotte. Found all 3 in this store only one-quarter mile away at great prices. Highly recommend.
pY-aLDz-FUOP9kg9f79a4A	Great little place, nice folks, has what you need when cooking Asian food.
U2W3kugm4UV0zsDPsSqQmQ	Good grief, here it is two years later, I'm back in the area, without remembering that this was the place where I had the earlier experience (see my previous review)  and the same thing happened as before except this time there was no long line.  \n\nI'm at the counter on the right with my six pack of cheap beer, happy it was only $2.99, go to pay and the kid tells me I have to go to the counter across the way to pay for it because he's under age.  Helloooo.  If this is (still) an issue, why not train these babies to glance down their line to check if anyone is holding alcohol so they can give them a heads up that they  can't purchase it in their line?\n\nAnd I wonder how many times this same thing has happened to OTHER customers in the two years since I wrote my first review??
U2W3kugm4UV0zsDPsSqQmQ	I happened to be at lunch at the restaurant adjacent to this Walgreens when I remembered that I was out of my favorite multivitamin, Theragran M, and that only Walgreens still sells it. Now my family stopped shopping at Walgreens when they came out with a loyalty card and started requiring BOTH the card and a coupon to get sales prices (you have got to be kidding, I have to hassle with BOTH of these to get a discount???).\nI found my vitamins and went to check out. The cashier asked if I had a card and I said "No thanks." Now I was not snarky about it, just factually stated I don't want one. The cashier literally THREW my change and receipt at me! When the guy behind me also stated he did not have a card he stepped back a couple of steps so he wouldn't be hit when she threw his receipt and change at him.\nOne star for having my vitamins, zero stars for the bad, bad attitude.
U2W3kugm4UV0zsDPsSqQmQ	I went to this Walgreens today to get a passport photo. This meant I had time to kill in the store while they printed. It was all very clean, well stocked, and organized.  The employees were friendly.
U2W3kugm4UV0zsDPsSqQmQ	I was here back in January (yeah I am terribly late with this review) and at first I wasn't too happy with them because they didn't open until 9am and we needed some stuff to be someplace else at 9am.  But when I had a medical emergency they came to my rescue!  \n\nFirst of all it's a Walgreen's - what more need be said.  My experience was with the pharmacy department.  Long story short....got sick, needed inhaler, forgot to pack inhaler, freaked out! Went to CVS at first because I usually get my scrips there.  Guess what? Not for the inhaler! Had to call doctors office and get him to phone in the prescription.  Had him call it in to Walgreens because I just happened to have the phone number from a receipt on me.\n\nGet to Walgreens and go to pharmacy.  I tell them could they hurry up the inhaler I was in distress.  They said it would be 15mins but they'd try for sooner.  I walk away dejected and wheezing but by the time I got to the front of the store to read some magazines it was done!\n\nThanked them profusely, used inhaler, went back to hotel to rest.  Never forgetting to pack it again!!!!
U2W3kugm4UV0zsDPsSqQmQ	I always go to Walgreens, I have tended to chose them over CVS again and again since they are usually cleaner and brighter and just more updated. I was just at this one on Stapley last week and the pharmacy tech was amazing. However my experience last night will keep me from going to Walgreens all together now. I was very sick, went to urgent care and was given a script. Walmart was closest to us so we decided to just see if they had this medication as it's hard to find, they said no and to try Walgreens which I was happy with. I get to the counter and wait in line 5-10 mins, it's around 8:20 when I am finally seen and I am told immediately without her even looking at my script that they are no longer filling scripts tonight. She said they stop half hour before they close. My mother a nurse who was a pharmacist said she had never heard ever in her 35 years of working in the medical industry a pharmacy still open turning away a sick patient filling a script. We truly couldn't believe she just said that, plus the poor people who had been waiting in line with me now all were receiving the same answer. We had to drive 15 mins in a storm to a CVS. I just pray they are not turning more sick people who need their meds away like that. It's a disgrace to the Walgreens name
bZj_Yd8gKYhZDHmppHsF4A	This place charges full price for a coffee cup filled with ice just to cool down the more expensive Starbucks iced coffee you're also buying. The old lady at the front desk was a miserable person and gave me the typical excuse of "I don't make the rules". Keep your excuses. \n\nThe ice bags are half melted and the soda machines are flat. Looks like a nice stop from the outside but save yourself the hassle. Worst gas station ever. Phoenix needs more Quik Trips! Zero stars!
bZj_Yd8gKYhZDHmppHsF4A	This place was, yes, was great when I first moved to Anthem. As I start to get along with the staffs, I get up-charged for my regular iced coffee. I usually have the 16 oz but recently they charge me with the 24 oz price, plus tax it's gonna be 2 dollars for a 16 oz-cup of iced coffee?! Well, it doesn't seem that much but if you don't have much money then this would be a trouble (I'm saving for my tuition). Gotta say goodbye to my favorite iced coffee then.
bZj_Yd8gKYhZDHmppHsF4A	Staff is always friendly. Bathrooms are always clean. THey have a red box movie rental inside. Gas prices are always about average. Across the street from a nice park.
WhBBLsuDQH_eNrV3Xvo3UQ	This Rabba has saved me on numerous occasions because it is ALWAYS open. Although not nearly the size of a full grocery store you can get all you basics there. \nThey have deli, a ready-made food section and a great selection of fresh fruits and veggies.
WhBBLsuDQH_eNrV3Xvo3UQ	watch out for the tuna or egg salad. Sometimes they mix the old with the fresh and thats not good.
WhBBLsuDQH_eNrV3Xvo3UQ	This grocery store is great for convience purposes.  This is not where I would want to do my weekly shopping at, only because the bigger grocery stores have larger items. The people are very nice, and I do enjoy rabba because anytime I need something it is right there.  \nThe only thing the store did not have when I really need it were pie crusts. Other than that it has met my needs.
WhBBLsuDQH_eNrV3Xvo3UQ	This is not the nicest Rabba I have been to. Prices seem higher than other locations and sandwiches taste a little stale. The only thing this place has great hours  If you are looking for a late evening snack, Sobeys is a much better option!
WhBBLsuDQH_eNrV3Xvo3UQ	whats nice about this particular place is that if your traveling in the area, this place can be a nice change of pace from eating out.  The store is stalked with all the major essential but what I like most about this place is that it has a decent deli selection and various fruits and vegetables which can be hard to come by when your traveling and living in a hotel most of the time.  Food price did seem a litle high to me but if your comparing it to convient store prices then I would say its in the same price range.  I tried a few of the prepared salads in the deli counter, I thought the wheatberry salad had too much oil.  THe chickpea and the coucous salad were good but a little over priced considering that prices are market per 100g which isnt a lot.
WhBBLsuDQH_eNrV3Xvo3UQ	Half grocery store, half convenience store.  So, basically, you can buy cigarettes and a choose from a selection of over 75 different types of gum while you buy your groceries.  Finally!\n\nSurprisingly, the grocery items here aren't as expensive as you may expect.  The prices are at least on par with the Sobeys down the street.  Maybe even a bit cheaper. This Rabba has a large "to go" counter as well.  I haven't tried anything from it, mainly because the "hot" food never looks hot when I go in there and I'm suspicious about how long it's been sitting out for.  But hey, what do I know?  Maybe I'm missing out.\n\nThis one super robotic cashier that works there cracks me up too.  I swear she's not programmed to make eye contact or say anything but "bag?" and "can I help the next person in line?".   I have literally not heard her say anything else to anyone in the 5 or so times I've seen her there.  It's awesome.  Is there some way I can nominate her for a SPOT award?
WhBBLsuDQH_eNrV3Xvo3UQ	A place I hate to love... so convenient and like Lauren M. mentioned, prices are surprisingly not, considering how convenient it is for the thousands of people who live in City Place.  The produce is usually pretty fresh and they tend to have specials on things like apples, avocados, and other things us yups like to buy. Friends have had their deli sandwiches and potato wedges from the hot "to go" counter and enjoyed both. \n\nThe only downside is that it makes it a little too easy to sneak down out a bag of chips or other treats... My fault not theirs. \n\nOccasionally during the week they will do cash back to save you the fee of using an ATM...
WhBBLsuDQH_eNrV3Xvo3UQ	Definitely NOT one of the best rabba's ive been too. Overpriced (what you get for living in cityplace) they had some tuna cans that had expired 2 years prior to me attempting to purchase them, "fresh" prepared meals are almost always stale and expire the same day and their sales arent the huge, usually small random items like berries  or kraft dinner. Otherwise, mostly convenient for picking up few items occasionally.
WhBBLsuDQH_eNrV3Xvo3UQ	Great little convenience store/supermarket with everything you need something your fingertips. \n\nGreat place to grab s quick salad and a decent sandwich too.
WhBBLsuDQH_eNrV3Xvo3UQ	Another Rabba. This one is in CityPlace just below the Matrix condos at the corner of Front/Blue Jay way.\n\nRabbas are somewhere in between a grocery store and a convenience store. They used to be quite overpriced, but nowadays I'm noticing the pricing is not too bad considering they are open 24 hours/7 days a week.\n\nThis one has a deli counter and "hot food to go" area with rotisserie chickens, sandwiches, salads, sushi etc. I like their falafel!\n\nThe place is packed after work with all sorts of yuppies picking up quick meals.\n\nAlso, an RBC ATM inside.\n\nVery convenient!
WhBBLsuDQH_eNrV3Xvo3UQ	Currently, this is my local Rabba. Since there are no 'real' grocery stores in the blue jays way/front area, I do most of my grocery shopping here. It's not too expensive, the produce is usually decent and they definitely have all of the basics. \n\nThe Rabba's sales are on every second week or so, and when its a sale period, there are usually some pretty sweet deals. Some of the classics include pizza's for 3.99, 4 bottles of pop for 5 bucks and a big pack of yogurt for 2.99.\n\nBy no means is the Rabba comparable to shopping at Loblaws, but beggars can't be choosers and this Rabba has treated me well.
