business_id	text
h23R_mGy3ZdKlOYj57bheQ	We travel to away Saints games and stayed here for the weekend.  The hotel was very nice all around.  Efficient , friendly staff and genuinely hospitable.  The rooms were in good condition and well-maintained.  \n\nSo were looking forward to returning for a woodworking symposium at the Lawrence Convention Center.\n\nI'd say lots was the same but some of the changes were irritating and so to be fair, the negatives first (ending on a high note).\n\nFor the game, a room. For this time, we had a King suite.  19th floor.  View okay but not great as advertised but hey, you're not there to sit in the hotel all day, right? :-)\n\nWell I had booked a corner suite but there was a bit of an issue with my profile on SPG and so they were "de-feathering" the room and it was taking forever. So I said, another corner suite was fine.  Except it wasn't.  It was a suite alright, but in the living area where one would expect a sofa, sitting area and TV, etc?  There sat a 4 top dining table with a hole in the middle. Turns out that lots of business travelers like this arrangement for meetings and all the suites below the 11th floor have this.  \n\nSO LOOK OUT before you book, people!  :-)\n\nBut seriously it wasn't a huge deal as they were more than happy to move me. And they did - to a complimentary upgrade King Suite that you could a tech startup in.  Very spacious, with dual closets, very nice sitting area with couch and two comfy chairs, two huge picture windows about the size of patio sliders.  A vanity area outside the (smallish) bathroom.\n\nAbout that bathroom. A couple things bug me when I travel.  One, is that some downtown hotels don't have a fan/vent in the bathroom, and so the mirror fogs up big time.  Not a huge deal and I use the hair dryer so I can see, but really? can't they do something?\n\nThe other thing is this:  I hate rain shower heads. I'm an old dude, I like my water pressure, not a rain forest gently wafting over me. I want velocity!  Hit me with that H20!  And yes, I know that we need to conserve water, but I have a seriously great low flow shower head at home and it cost 20 bucks on Amazon.  Sheesh!\n\nAnother gripe:  There were exactly two places to recharge a device in the entire suite, and both were at a side table about 12 feet from the bed (and only halfway across the room)!\n\nNow, between us we have 5 devices to charge including phones. I use mine for my alarm and like it right there.  So really, can't we have a retrofit so grown folk can charge their whatsits?\n\n\nFinally, the elevators. What?  How can that be an issue? Well, since our last visit, they installed a software/hardware package that eliminates the buttons inside the elevator. Instead, there is a touch screen at each floor.  One selects the destination, and the screen lights up with a large number telling you which elevator. \n\nWhich SUCKS.  I'm sure they're using some kind of load-management software to optimize elevator use, and I'm sure that the goal is more efficient utilization and less latency.  Well it ain't makin' it.  You wait and wait and wait.  Then sometimes - if you're like me - you forget which elevator you were supposed to take.\n\nI did find that, it seems that if you go press all the screens with your floor and perhaps those above, the software sensed increased demand and sent an elevator quicker.  Hacking an elevator. Who'd a thought it?\n\nNow to the good:\n\nThe staff were super friendly, warm and helpful.  So when I asked, they found a power strip and a 25' orange extension cord and I ran it over to the bed along the wall.  Sort of the Clampetts come to city with my cord running all over the room. Nonetheless, we had power to our devices.\n\nThe room was otherwise nice and quiet.  Did I mention that it was large? \n\nThe hotel restaurants are good. Penn Grille is more relaxed overall and Bill's is more of a "joint" but the burgers are great, as are the nachos.  The service in both is excellent and the staff are unfailingly friendly - really hospitable the way we mean it here in the south.\n\nThe hotel is attached to the Lawrence Convention Center, which was nice as it rained some each day. We made it to the various events high and dry.\n\nI would say that the high point of the hotel is without question the attentiveness, courtesy and genuine friendliness of the hotel staff.  Not that fake, I'm polite but really looking down on you courtesy that we've experienced at the Ritz in Chicago (which I reviewed last year).\n\nIn fact, if this hotel was sited next to the Ritz, and the price was the same, I'd choose the Westin, hands down. And given that the rooms were less than half that of the Ritz, that's a good indicator of how well we were treated. \n\nMy wife tipped the housekeeping lady $300 because she was so nice. What else can I tell you?  Stay there.\n\nAnd Pittsburgh, you are an awesome town. Good people, beautiful views, and a good nightlife too.
h23R_mGy3ZdKlOYj57bheQ	Great location, central to many Pittsburgh locations. I must say though, I'm glad that I've always stayed here on someone else's dime. It's not cheap. The parking is pretty pricey, around $20 a day. If you're looking to save a few bucks I believe you can park around the corner at the Greyhound Bus Terminal for about $14 a day (?).\n\nBeds are super cozy. I'm a huge fan of their toiletry line - white tea aloe! Also a big fan of the fact that their in-room coffee is starbucks (see photo!). Thank god. The front desk staff seem very helpful, but I have not really had many interactions aside from the check in & out processes. \n\nConnected to the convention center if you're traveling for an event there - can be convenient in the winter months since there's no need to walk outside. \n\nThe gym seems amazing. They now have a program where they'll even lend you workout clothing (there may be a small fee?) and shoes! If you're traveling by plan and have limited packing space this could be a life saver!\n\nOne thing that really burns me is the internet. It's "free" but when you log in, you'll see there are actually 4 or 5 different options. I have a feeling that if you're not paying you're getting lower bandwidth. Annoying. Would do 3.5 stars if I could.
h23R_mGy3ZdKlOYj57bheQ	My husband and I recently called the Westin home for four nights while we were in town for a wedding.  We booked the hotel at a great rate on Hotwire.  Knowing fully well what we were getting ourselves into by perusing their website (what's in the neighborhood, price of parking, restaurants in the hotel, amenities, etc.), we were a little bit afraid that since the hotel was next to the convention center, that perhaps the hotel stay would feel too "corporate."\n\nBut, this was not the case at all.  We felt so at home in this room.  We were on a high level floor (Starwood Preferred), and our large hotel window overlooked the rivers and the ballparks.  We even got to see fireworks the night we arrived!  I had called ahead to let the hotel know that my husband and I also were coincidentally celebrating our anniversary that weekend, so we were welcomed by a complimentary bottle of champagne and a plate of chocolate covered strawberries.  SOOO delicious, and SO good after a long day of flying across country.\n\nThe hotel charges $24/night for valet, which was worth it.  Self-parking is only a few dollars cheaper every night, but it really saved the long haul of luggage and having to walk with tired feet coming home late every night.  And the valet crew was outstanding.\n\nAnother perk is that there are two restaurants in the hotel.  One of them closes late every night, so there was no lack of food or drink any minute of our stay.  The additional bonus is that Downtown Pittsburgh is pretty hopping and busy, and being so close to many great restaurants and theaters, there is no shortage to all the fun and interesting things within walking distance of the Westin.\n\nAnd, to me, the best thing of all of the bed!  It was one of the best beds I have EVER slept in, and I unusually was able to get right to sleep once in bed, and I stayed asleep.  Oh, man, I'm still dreaming about it!\n\nIn the end, loved the hotel.  Would stay in again if the rate was right.
h23R_mGy3ZdKlOYj57bheQ	This is a very good hotel and with a corporate rate of $107 per night it is the best bargain in town.  I stay in hotels in the city often rather than drive home after a night  of partying and I used to stay at the Holiday Inn Express S. Side for the location.  The holiday inn cost is $140 per night and the hotel is fine for a place to crash for a few hours, but  the Westin is actually a place that I look forward to visiting.  The rooms are pretty big.  Request the higher floors because the view is awesome.  I stayed on the 25th floor last night and had a great view of the arena and train station.  The beds are great.  They also have a fridge for you  to put your own drinks.  However, I think they  should have a minibar.  Mario the doorman also is pretty helpful.
h23R_mGy3ZdKlOYj57bheQ	The Westin was everything you can expect in a downtown hotel.  Great view, high quality finishes and fixtures in the room, world class workout room, outstanding lobby and great staff. \n\nWe came into town with a Steeler game on Sunday and a Pirates home stand over the weekend. Needless to say this place and everything else going on downtown was very busy that weekend. \n\nThe Westin was the perfect place. 8 blocks from the stadium and 8 blocks from the famous Strip District. Couldn't be a more perfect location for a family weekend in Pittsburgh. \n\nOnly gripe was the elevators. On numerous occasions it stopped on 3-5 floors on the way up and down for passengers that weren't there.
h23R_mGy3ZdKlOYj57bheQ	I do not understand the new obsession with hotels' being "green."  We were offered the chance to decline housekeeping (is this just to give them an excuse to fire some of their employees?) and to turn off one of the two awesome showerheads (what an awful idea), and were forced to insert our keycard into the light switch in order to turn on some of the lights.  \n\nNone of it was that big of an inconvenience, but it all seemed bizarre to me.  And unlikely to be that significant relative to bigger decisions like using energy-efficient machines to wash the sheets, having quality insulation to save on heating and cooling, and so on.  Maybe the Westin does these things too, I don't know, but it seemed like the little annoyances in the room were more of a marketing gimmick than a substantive step.  (And like a previous reviewer, we noticed a faint smell of sweat and human body odor in our room.)\n\nBeyond that, it's fine--parking isn't cheap, the wireless is unreliable and slow, and in-hotel food options are dubious--but it's squarely in the middle ranks of what I have come to expect from downtown hotels in secondary American cities.
h23R_mGy3ZdKlOYj57bheQ	I was sooooo disappointed with this hotel. I'm not sure what they use to wash their sheets and towels but the sheets were so dry and harsh I could barely sleep. We asked the front desk about it. They offered to replace our sheets with "brand new ones" you can't even tell the difference. \nThe AC barely works. Our room was stuffy and hit the entire time. \n\nBottom line: it was way too uncomfortable for costing as much as it did. I'll never stay here again.
h23R_mGy3ZdKlOYj57bheQ	I stayed at the hotel for several months during the late fall/winter of 2006.  I love this hotels decor - minimal and clean lines which I prefer over the fussiness of the William Penn.  The heavenly beds and showers are really just that.  The shower is 1000xs better than my own apts so it was hard to get out each morning.  They are dog friendly, very dog friendly.  Bringing my dog a bed, treats and bowls.  Wish I had known that in advance as I had already hit Petco.  The doorman greeted my dog everyday with "watch out her comes killer"  yeah lame but I love when my dog gets attention.  He also pet him so I will let it slide.
h23R_mGy3ZdKlOYj57bheQ	I am a fan of this hotel.  I've stayed here many times while visiting Pittsburgh and family for holidays and non-holidays.  The rooms are big and and usually very clean (never any weird smells like some have repored).  I like that they are green and that you need to put your key in a slot to keep the lights on/turn off lights automatically when you leave.  The staff are always really nice and have even upgraded me in the past.  I usually get my room via Priceline and they are generally the best deal in town for a nice place to stay with a view.  (I think the availability of this hotel on Priceline and Hotwire has nothing to do with the quality of the hotel, just quantity.  This is a convention hotel and when there isn't a convention going on, it really seems empty...especially on a holiday.  During those times it is almost as if you have the place to yourself.)  \n\nQuick tip: Park in the huge garage/bus terminal 1-block behind the hotel.  Much cheaper than valet parking and inexpensive for downtown parking.\n\nQuick tip 2: A modest tip goes a long way for better housekeeping service.  If you want some extra coffee/tea, extra shampoo, extra towels, etc...leave a tip.  I even got a nice "thank you" on the notepad. \n\nQuick tip 3: Try the bar called "Tonic" across the street.  Good drinks/appetizers.
h23R_mGy3ZdKlOYj57bheQ	Stayed overnight and was pleasantly surprised.  Very clean and staff was friendly.  Rooms were large and the bed was extremely comfortable.  Only knock is the underground self parking lot is very poorly marked and difficult to spot until you have committed to pulling into the valet parking.  I drove in circles until I gave up and pulled into valet, and then I saw it.  Also, the rate in this lot is the same regardless if you are staying at the hotel.  $22 for 12-24 hours.  Other than that, nice place.  I would stay there again.
h23R_mGy3ZdKlOYj57bheQ	What a waste of money. I traveled home for a wedding and went out of my way for a luxury experience and booked a night at this Westin and I was very disappointed. This had already been the trip from hell, so I was too exhausted to complain when I checked out. I just wanted out of there. First off, at over $200/night, can you not offer shower gel and/or face wash? I didn't pack toiletries, falsely relying on these items being provided in my room. Wrong. Next, the bed was so uncomfortable. Were those springs I felt in the mattress? Really? It was bumpy! And the sheets... They felt like cardboard. When I pulled the fitted sheet off the mattress to investigate what was so uncomfortable I found hairs matted to the mattress cover. Grrrross! I'm done with the Westin brand and someone seriously needs to contact me about getting my money back. Never again. Heavenly bed? Quite the opposite.
h23R_mGy3ZdKlOYj57bheQ	I usually look for the westin whenever im traveling.  On my recent trip to Pittsburgh I booked this one specifially because of the close proximity it had to PnC park since I was catching a game.  Yeah its in downtown and its a huge hotel but this downtown is not really the hangout spot in pittsburgh.  Theres a couple of restaurants and I counted like three lounges after walking round a bit but none that caught my attention.  Teh hotel itself is ok not that super clean like the Aloft hotels.  The hallway carpets were stained and my bathroom was clean but outdated.  At least the bed was comfy and free of bedbugs(I check for that as soon as i enter the room a pet peeve of mine).  It's huge so whenever your trying to talk to someone at check in theres always a line.  Next time I will probably look for its sister hotel Aloft because this seems to be the better out one among the sheraton,westin and Aloft.  Oh yeah you have to pay for valet no private lot this runs about 20 bucks a night.
h23R_mGy3ZdKlOYj57bheQ	Great room, great view, definatley top notch hotel, although some odd stuff with key cards in the light switches and other strange stuff that seems like a finger juggle for having the guests get more involved with their counting.
h23R_mGy3ZdKlOYj57bheQ	This Westin is conveniently located near the convention center, but the low relative rank amount of stars is deserved.  I am in a hotel once or twice a month.  This Westin is bottom tenth.  The coffee maker is disgusting and smells.  The beds are constantly short-sheeted, mostly with poor effort.  The phones and clocks are gross.  I gave the management a heads up, and it was not fixed.  Bottom line...  They don't care, so don't frustrate yourself and risk the dirt.  On the bright side, a woman on the elevator was insistent something bit her last night, and I seem to have dodged that bullet.
h23R_mGy3ZdKlOYj57bheQ	Such amazing service, found our room to be damp from a running shower. Upgraded our room in a timely fashion
h23R_mGy3ZdKlOYj57bheQ	I stayed here for a 2 day conference and was not overly impressed by the hotel. Westin has established a name for itself, but this hotel fell short. The service was wonderful, pool and fitness room above average, and the location was prime, but the hotel rooms are in need of updating and renovations. \nIf I was paying for this trip, I would have been very disappointed.
h23R_mGy3ZdKlOYj57bheQ	Yes the beds are comfy and all that... but creature comforts aren't what merit the 5 stars.  A human does.\nHer name is Nasiba.  She's a housekeeper, and she made the room sparkle.  There's no geiger counter that can measure the TLC put into a tautly-tucked bed sheet, but if there were... it'd be spiking in Nasiba's rooms.\nI tracked her down and met her in the hallway, and we had a nice chat.  She's a delight.  She's Turkish, and was a refugee in Russia, but apparently they didn't exactly roll out the red carpet.  She smiles (and melts your heart) when she tells you in her still-being-honed English "but I came to America seven years ago, and America took me in.  I became a citizen three years ago.  I am American now."  Big smile.  Man oh man, in people like her (hard-working and affectionate toward her new home) you see, and revel in the fact, that we are indeed a nation of immigrants.  She took the time to do it right.  And it's moving.  I told her we're very glad she's here.\nPlus, she has a little American flag in her huge cart.  And that made me smile.\nShe gets the Unsung Award of the day.
h23R_mGy3ZdKlOYj57bheQ	It's been about five years since I stayed at the Westin, and what I remember -- other than that the words of Annie Dillard were scrolling on the roof all night -- is that when I asked at the front desk for help finding a souvenir, Monica went to a flabbergasting amount of trouble (on her own personal time!) to hook me up.\n\nSo it's like this. My name is Ben. The name of the Steelers' quarterback (beloved perhaps even more in 2007 than he is today) is also Ben. As a result, there seemed to be a lot of not-quite-trademark-infringement merchandise in the Steel City, and much of it had my name all over it.\n\nBut I couldn't find a "Ben At Work" sign, try as I might. I asked Monica, who was working at the front desk, if she could help me figure out where to buy one. I figured she'd just tell me if she happened to have a few suggestions.\n\nSome people, it seems, just like a challenge.\n\nWhen I saw her that evening, Monica had walked up to the Strip District to canvas all the tchotchkie-mongers and tourist traps. She had come up empty-handed. I was astonished that she had gone to such trouble, but I accepted that there were no Ben At Work signs for sale between the Allegheny and the Monongahela.\n\nSome people, it seems, just like a challenge.\n\nUndaunted by such silly little things as the complete and total nonexistence of the desired merchandise on store shelves, Monica got creative. She remembered having given a magnetic "Ben At Work" sign to a friend and called that friend up to ask whether she might be able to get it back.  The friend said "Oh, that? I gave it to my mom."\n\nSome people, it seems, just like a challenge.\n\nThat's when Monica called up her friend's mom out of the blue and asked if she still had the sign, and whether it had any sentimental value. No, it doesn't, why do you ask? Well, you see, a guest at my hotel asked if I...\n\nNext time I saw Monica, she had (after finishing her shift at the most popular convention hotel in the city) driven across town to the house of a friend's mom to retrieve the precious artifact.\n\nHere's a photo of her handing it to me. http://j.mp/BenAtWork\n\nAnd when I offered to pay her what she had once paid at the store, she wouldn't take a dime.\n\nAnd when I offered to pay her for the gas she'd burned driving across town, she wouldn't take a dime.\n\nI assume, based on the letter I wrote to the hotel's general manager and copied to corporate (back in November 2007), that she has since been promoted far higher than the front desk. But it wouldn't surprise me a bit if I found out that she had declined to be promoted to a position where she couldn't surprise and delight her customers.\n\nSome people, it seems, just like a challenge.
h23R_mGy3ZdKlOYj57bheQ	This is a nice convention center perfect for big events and conferences. Its spread out so if your conference has workshops in just about all of the classrooms like mine did then be prepared to walk! \n\nThe garage is very pricey of course but what garage these days isnt. It can also be quite confusing on which end to park at and which elevator to take. \n\nThe location is ideal! With the Westin Hotel being the connecting hotel. However there are only 2 elevators to get you there which can be a cluster F! Plenty of restaurants within walking distance to the convention center. Kinds of pricey and comparable to our Over-the-Rhine area but not as nice! The view of the river is near is well which a great. \n\nOverall not a bad place to hold an event.
h23R_mGy3ZdKlOYj57bheQ	I have been coming to Pittsburgh for quite a while, and knew this location as the Vista before being taken over by the Westin.  This is also the location for all the visiting teams coming into Pittsburgh for the football and baseball games there.  \n\nWhen they took over, they added the "Heavenly beds" (big beds with pillow tops and great duvets) and "heavenly showers" (which have the bowed shower curtain to give you more room).  The trick we learned was to get to the room, turn on the airconditioning, and when you get back get under the duvet.  It is great. \n\nThe staff here is great too.  The doorman will also arrange a limo for your transportation around downtown if you play your cards right. \n\nThe restaurant there (Fish Company) is OK, and the bar is great.
h23R_mGy3ZdKlOYj57bheQ	The Westin gets five stars for being flexible, friendly and accommodating to this working mom. I'm a breastfeeding mother who was on my first business trip away from my child. I arrived at 7:30 in the morning after taking a red-eye and during my stay requested access to a private room before check-in and access to a freezer.\n\nThe Westin staff went above and beyond to help out and even offered to move my luggage into my hotel room once it became available so that I didn't have to leave my convention session. \n\nEveryone I encountered including the cleaning lady on floor 21 and the guy who delivered a refrigerator to my room was prompt, helpful and friendly, even at 4 a.m as I was leaving the hotel.\n\nFor a city-dweller who doesn't mind walking, the Westin was also within 30 minutes stroll to a great weekend farmer's market and the Mattress Factory, a contemporary art museum. We had delicious soul food at Carmi Family Restaurant. Overall I was pleasantly surprised by the convenience of the location to arts, culture and good food.
h23R_mGy3ZdKlOYj57bheQ	I've stayed at this Westin a few days a week for about a month. While technically located downtown, it's more on the outskirts of downtown (just based on my observations). It is connected to the convention center but I've never been inside so I can't give an opinion on it.\n\nMy overall experience at the Westin has been positive. There is no 'Wow' factor but the gym is incredibly nice (but close at 10pm). The rooms are standard with all the normal Westin perks, such as a bathrobe, dual shower heads, and heavenly beds. There is an option for free slooooow internet but platinum members get internet for free (yay?). \n\nI hadn't noticed at first but after someone pointed it out, you'll notice there is an odor in the halls and rooms. It isn't very noticeable but its there.
h23R_mGy3ZdKlOYj57bheQ	We stayed at the Westin Convention Center at the end of June 2013.\nThe front desk staff was very friendly.  He helped us out with toiletries (since my bags were lost) and great locations to eat.  He upgraded our room to one near the top floor with an amazing view of PNC Park and Heinz Field.  Since we were staying there for a Brewers-Pirates game, this was a huge bonus!  \nThe hotel had a free shuttle that took us to the baseball game.  \nDon't bother with the pool - it is TINY and you have to sign in and out to use it... very odd.
h23R_mGy3ZdKlOYj57bheQ	Elizabeth at the counter was extremely helpful, professional, & attentive. My\nFiance took me me out for a night on the town, she directed me to the bathroom, in which time she asked my fianc why we were there. He told her we were in the city to treat me to a night before he had to go out of town. She really took to heart why we were here, and gave him a room high up with a beautiful view to make our night complete. She had great salesmanship and service all the way around. Fed a shout out to the door guy, mark, very cool and helpful guy!
