business_id	text
o7WABjZct-u2gpBR8LXckQ	Love Costco! Clean store, friendly employees (if you can find any; it is difficult to find people to help you find stuff), and good benefits. You can only buy stuff with cash or American Express in the store, but this is just another way they keep prices down.\n\nLines are long on the weekends, but if you come at off-peak times you can make your way through the store fairly quickly. Staff is knowledgeable and there is a ton of selection of products. The quality of the food here is higher than other clubs and sometimes you can get things here that you can't get in a normal grocery store. Watermelons are great, produce in the refrigerated section is fresh, and they have a huge selection of wine and alcohol ranging from cheap to expensive. Meats are fresh and even salmon is often fresh and odorless.\n\nUnfortunately some products that become favorites are only seasonal or only carried for a limited time, but sometimes if you talk to the management they can get the products back in the store. \n\nGas is inexpensive and high quality, you get cash back with the Costco Amex (you can only pay for gas with Costco cards or a PIN debit card). Once again, you can expect a high quality with Costco products, and if you ever have a problem, their customer service is fantastic. The employees care about their guests and you can tell they are treated well by the company.\n\nThumbs up!
o7WABjZct-u2gpBR8LXckQ	Terrible customer service today. We have a business transferable credit card for Costco and have NEVER had a problem. We are a part of a non profit organization that has multiple campuses. The cashier questioned us then called over the manager - they had to look up our business account. I had to have our manager text me her photo ID and proof we were with our company. People from our corp use these transferable credit cards all the time and we have never had an issue. I think this location treats you like you're a criminal not a customer. \nThe one off of Market street is so much nicer. I will not be returning.
o7WABjZct-u2gpBR8LXckQ	I enjoy going to this Costco. You have to make sure to get there early b/c it gets packed really quickly. They always have an adequate amount of check out lanes open
o7WABjZct-u2gpBR8LXckQ	Usually great customer service. Tonight I went for gas at 9:15. Was told by nearby attendant that gas closes at nine. Had my Costco app open in my hand which says 9:30. He was not interested, and confirmed there was nothing he could do because the pumps are already off.
o7WABjZct-u2gpBR8LXckQ	I have been a Costco customer for eons, and I have always been very satisfied with them.  But this last summer, I was going to use one of their vendor/subcontractor services for buying and installing new hardwood flooring in my home.  Eventually, I went to someplace else.  This vendor/subcontractor gave me the worse customer service you can imagine.  Misquote (or quoted) 3 different prices on different occasions; claimed he couldn't remember dealing with us despite us being in his store on 3 different occasions; wouldn't come out to bring samples and insisted we come to his showroom; and the last straw was when he was a no-show for a measurement appointment in our home.  While he was only a vendor/subcontractor, my complaints to Costco headquarters went unanswered.  I wrote letters; called their HQ; and even went thru customer service on their website -- all to no avail.  The only conclusion I can draw is Costco doesn't want to hear about problems, they just wish complaining customers just go away. The purpose for this posting is to perhaps warn Costco customers not to use vendor/subcontractor services -- dealing with Costco directly might be OK, but not their vendor/subcontractors.
o7WABjZct-u2gpBR8LXckQ	Finally I feel like a real adult because I got a Costco card this year! Granted, as part of a family membership, but lets not get hung up on semantics. It doesn't change the adult quota stock points. I eat dessert for breakfast, go to bed when I wanna, and get giddy from the idea of spending under $4 for a pack of 40 water bottles. \n\nBAM! \n\n::adult card thrown down::\n\nThe cafe prices are unbeatable so don't forget to bring some cash to spend on a hot dog, slice of pizza, churro, or giant cup of soft serve on your way out the door. \n\nAs for the poor guys up front, towards the entrance, that ask to speak to you for a moment about DirectTV (Seriously, why? Oh, right-right, because I'm an adult). I feel so bad that I brush them off (because let's be honest that's probably what everyone else does too), but I don't have time for that when I've got some free samples to indulge in, comfy sweatpants to check out, need to stock up on food like I'm feeding a few very hungry soccer teams or filling the shelves in an underground bomb shelter, and most importantly, to hug MEGA-JUMBO Teddy Bears (when they are in season)...because that is what an adult does!
o7WABjZct-u2gpBR8LXckQ	Love going to Costco to eat lunch and stock up on our lunches for the week.  Wish all of the locations had the same things.
o7WABjZct-u2gpBR8LXckQ	Don't write me off as a simplistic food reviewer, but CostCo pizza is really really good. For $2.59 you get two thick slices of pizza (cheese, pepperoni or supreme) and a large fountain drink.\n\n***************************************************************\nIs it KOSHER to do two reviews of the same place? This time it's all about the hot dog! The other review was on the pizza, so they warrant two totally different reviews, right?\n\nFor a buck fifty you can get a Hebrew National dog (see, now you get it Kosher, huh, I'm witty) and a soda. And people, it's a big dog. There's not a lot of options. You can ask for kraut at the counter, but standard fixings are yellow mustard, katsup, sweet pickle relish and onion.
o7WABjZct-u2gpBR8LXckQ	What is not to love about Costco?  Oh, maybe that the bathrooms are so far away, the lines to pay are usually long (they do move quickly though) or that the snack bar doesn't take debit cards.\n\nWell, even with these little problems I still love shopping at Costco.  The products are good, the prices are good, the samples are fun and delish and the coupons are a bargain.\n\nLove my Costco membership!
o7WABjZct-u2gpBR8LXckQ	Only went for tires.  The guys there are great.  When I broke a rim and needed a couple tires swapped around they mounted two and realized my old spare was toast.  Chris and Phil mounted an older tire I had on hand.  Thanks guys.  10/10 would but tires here again.
o7WABjZct-u2gpBR8LXckQ	I like going in the early afternoon during the week. I avoid the weekends and the weekdays after 4pm like the plague. Crowds drain me. I avoid them when shopping. \n\nI like the bulk prices, clean store, friendly staff. However, I'm not the exploratory type, though that is one of the personalities Costco markets. That's why there are no aisle signs. They want you to explore, discover, and search for what you need - in hopes you stay longer and end up buying more of what you see, even though you don't need it. It works, even on me. I admit.\n\nAll in all I go because I have a consuming family. So buying in bulk saves me money and time because - in theory - we won't run out of things as quickly.
o7WABjZct-u2gpBR8LXckQ	I love Costco.  Great prices, decent customer service, great lunch deals!  Where else can you have a 1/4 pound hot dog and a drink for $1.60?  Of course they have free samples that encourage you to buy an item.  They sometimes hook me with those.  But you can have lunch every day in that place and never spend a penny.  And like Elle said, the items are a much higher quality than Sams Club.\n\nIf you didn't know, Costco is a warehouse club that sells things in bulk.  Then also have jewelry and electronics that are a great deal.  I often order items from the web-site when I can get free shipping.  Also note that they have great prices on tires (often beating Discount Tire) and gasoline.  The pumps are a little hidden on the east side of the building, but they have plenty of them.  No diesel though.\n\nThe only downside to this Costco is the parking.  Holy shit!  There have been many times when I've wanted to go postal on the morons who are parking their 25 foot long SUV's in tiny assed spaces blocking the entire aisle for 10 minutes while they lube up the sides to squeeze in.  All this while they yap on the phone and adjust their tits/nuts.  But then, I'm impatient.  I usually park on the side lot south of the tire shop.
o7WABjZct-u2gpBR8LXckQ	Typically the most economical place to purchase gas, provided you're a member.
o7WABjZct-u2gpBR8LXckQ	Costco is one of my favorite places on earth.   I get all my electronics, computers, cameras etc.  How can you go wrong with their return policy and high quality products?   The food is great too.  \nWe like to get the $10 large pizza or $1.50 hot dog and drink.  There are just too many great things about this place.  The membership fee is a fraction of what you can save by shopping here.
o7WABjZct-u2gpBR8LXckQ	Shhhh! \n\nIf you promise not to tell, I'll tell you a secret. There's a *certain* kid who has a birthday coming up, and if you were looking for a *certain* toy that costs at least double everywhere else, this is where you would go. \n\nThat's one of the things I do enjoy about Costco. They bring stuff in and out pretty quick, so every trip there is different than the last. But there are also the staples in the foods and home goods sections that you can stock up on when you need to.\n\nThis location stands out because after having been a few times, I've yet to have too hard of a time parking and it's always been pretty tidy. Please note, however, that I have yet to visit on a Saturday. Saturday at a Costco? What--do you have a death wish?
o7WABjZct-u2gpBR8LXckQ	Costco is my religion. It is my heart, blood, and soul. It is my lord, and personal savior. It's my Madonna. Everything at Costco is amazing. Everything. I will fight or slice someone who dare speak ill of Costco. I wish that everything I own, use, and operate was Kirkland brand. I want a Kirkland wedding, and a Kirkland created husband.  I dream of the day that Costco rules the United States in a form of glorious Communist Retail Utopia!
o7WABjZct-u2gpBR8LXckQ	Costco never disappoints. Looking for bulk items? Costco is your place with great prices and quality!
o7WABjZct-u2gpBR8LXckQ	If you need tires go see Art at Costco.  He was a great help and educated me about my tires without making me feel like a dumb woman. He didn't try to upsell me, he actually sold me tires that were cheaper because he said the quality was better.  I would highly recommend getting tires from here.
o7WABjZct-u2gpBR8LXckQ	Best prices on snacks, gas, protein bars, cereals, gas and cheese. Every Costco is a little different. You might find something at one and not at another but you will always find something you like at a great price no matter which one you go to. The pizza at the food court is actually pretty good too and it's only 10 bucks for a large pie. They have some pretty good frozen yogurt in a large quantity for under 2 bucks and it tastes just like ice cream. You can never go wrong with a Costco membership. I've been one for years and have never regretted it.
o7WABjZct-u2gpBR8LXckQ	This is also my favorite Costco, with an easy to get to location.  During the construction on Arizona, it's especially useful to access this Costco via the back driveway onto the small side streets within the block.\n\nI can reliably get  Lean Cuisine in bulk at this Costco for two bucks each.
o7WABjZct-u2gpBR8LXckQ	Costco has things that Sam's Club does not.  I feel that their bakery is superior.  I also like their meats a little better.  Costco has more of their brand items as well.\n\nThey offer 3 types of membership- business, gold key and executive.  I have seen them raise their prices over the past 5 years.  We are on a membership with my family and business and our executive membership pays for itself as well as a few other memberships.\n\nCostco has coupon books throughout the year that can give you even better deals on items.  I also know that if you are looking for a deal, to notice in the price if the last number is a "7".  I have found air freshners on clearance for $3.97, as well as other items for a great deal.\n\nTheir cafe has changed little over the years.  We really like their food- except for their non-fat yogurt.  It tastes like marshmallow fluff to me.\n\nIn addition, check out Costco's website.  They have deals there that they do not have in their stores.  My sister got her wedding invitations at a great deal online.  Their travel section is pretty good too.  Not great, but getting there.\n\nI personally find this location more crowded than the other ones.  I know it is all about location though and going to the one that is closest to where you are.
o7WABjZct-u2gpBR8LXckQ	I love Costco. I usually do quite a bit of fresh food grocery shopping here. The produce is great and decently priced. When I go to Safeway for strawberries it's always a matter of finding the container with the least moldy ones, not so at Costco. They've just started selling crab stuffed portabella mushrooms which are delicious!
o7WABjZct-u2gpBR8LXckQ	Lets hear it for Costco! Costco has great customer service, clean aisles, openness, good deals on: gas, food, home, clothes... and selling my favorite pizza by the slice - Plus, I LOVE the free samples! If you are handing out free food, I'm there! (Maybe that's why Yelp events are so much fun for me!!) \n\nI love coming to this location because it's really close to my house and it's not usually too crowded so I get pretty good parking. If any one wants to come with me on a Saturday for some free samples just let me know! :D
o7WABjZct-u2gpBR8LXckQ	As I worked here for a week, i observed the comings and goings of this Costco. The lines at the register at times stretched way back into the aisles, but for the most part Costco opened extra lanes for members to go through. The average wait time was about 10 minutes especially on weekends, lunch time and between 5pm and 6:30pm. The managers as usual were hit and miss, with the majority being unfriendly and stand offish. The employees though were always helpful and nice to me and the members. The snack shop did a good job also of moving people through when they order food and the pizza at this location was pretty good, still at $1.99 per slice. They added a brisket and turkey sandwich, but did not try those items.\nDo not agree with that receipt check on the way out, it is just a bit too much. This location is very crowded and good luck trying to grab a sample on a weekend, the members swarm those carts and things get crazy for a free taste of anything.
o7WABjZct-u2gpBR8LXckQ	Costco Food Court has new hot dogs! Now they aren't Hebrew National anymore, so they aren't Kosher, but they are all beef and delicious.  I had the polish, I prefer it to a regular dog, and I like it more than the old Hebrew National polish dogs.  It has more of a bite to it, definitely more pepper flavor to the dog. Still the same price $1.50 + tax for a dog and a drink.
o7WABjZct-u2gpBR8LXckQ	This is the my favorite Costco. It's less than 8 miles from my house and the staff are so nice. Most important, the fruits are fresh.\n\nNot all store are dealing with customer the same way. I find that customers shop at this location are more polite than other location. The parking lot are a lot of bigger than other location.
o7WABjZct-u2gpBR8LXckQ	I love Costco and this location is a good one. As with most if not all Costco's, this one can get crowded. I have found it is always clean, the restrooms included, plenty of carts available and if you're lucky enough to get there before they put the samples away, a buffet awaits. I'm lucky enough to live right in the middle of the triangle created by this location, the Costco near Chandler Mall and the Costco in Tempe on Elliot. It really depends on what I'm doing when I decide which location to go to. I have not had a bad experience here and have found the staff to be pleasant and helpful.
o7WABjZct-u2gpBR8LXckQ	The customer service here  is terrible. Employees make false accusations and their membership is a rip off. You don't save money here if you know how to shop savvy! What a load of crap!
o7WABjZct-u2gpBR8LXckQ	Still giving this a 5 star.\n\nMost recently, I bought a step ladder and while at the checkout, Steve noticed that one of the rungs of the ladder was dented.  I didn't see this.  He took my dented ladder, put a tag on it, and went and got me a good, non-dented ladder.  This is employees taking the time to care for their customers.  Though I didn't notice it, I'm sure my husband would have noticed and that would have caused me to need to come back and return it.\n\nI've never had a problem with any time I've had to return things here, either.  It's very efficient and the personnel at this counter are always nice and professional.\n\nThe guys at the gas pump, particularly Manny & Jim, are top notch.  They've been there for years and I always appreciate and enjoy seeing them.  Since the gas pumps pump gas so quickly, I rarely get much time to chat with either of these gentlemen.\n\nThe only suggestion I have is for your cart returns, why don't you make them like WinCo's?  Yes, I know your carts are bigger, but WinCo has cart returns that are the most efficient of any store I go to.  They have a 2 aisle (not sure what you would call this) return that are opposing.  Carts go only 1 direction in one aisle from one end, and then one direction from the opposite end.  WinCo has this from main aisle to main aisle so that when Cart Man has to go from Main Parking Aisle 1, he can just easily cross to Main Parking Aisle 2 easily, then to Main Parking Aisle 3.  I've seen him do this in a manner of a few minutes go through several Main Parking Aisles.\n\nCurrently Costco has such a big cart return area that people just basically throw all the carts in willy nilly.  Then the person picking up the carts has to sort through and organize the carts, which takes time and is inefficient.  He has to address the carts in each parking aisle separately and can't easily go from one parking aisle to the next easily.\n\nCustomers suck in returning carts often, but if you had something similar to WinCo's, yet accommodating your big carts, it would cut down on time gathering carts as it would automatically be organized.  What makes WinCo's cart returns better also is there is a swing door thing that only allows carts to go in one way and in that one cart return aisle.  \n\nLowe's and some WalMarts do have the 1 cart return aisle, but that 1 way swing door makes a huge difference in keeping only carts going in one direction facing one direction.\n\nYes, I also understand you guys have carts with 2 different sizes, and you can accommodate this, too, just another cart return aisle for these.  Hope that makes sense as Costco is known for their efficiency.  Why not make the cart returns efficient, too?  Also, place an area where people who don't want their "boxes" that you guys put stuff in that they can discard there.  I see people leave these boxes in the carts and that must be a pain in the butt to remove and gather all the carts together.
o7WABjZct-u2gpBR8LXckQ	Big selection, reasonable prices.. I love buying in bulk because not only do you save, you get quality products. And it matters to get a good product for a good price.\nI usually buy their produce and I love how it always tastes great!
o7WABjZct-u2gpBR8LXckQ	You've seen one Costco, you've seen 'em all, they say. Or so I've heard. Maybe I just say that because I've never really met a Costco that I didn't like.\n\nThis one is a particular favorite because it's so close to my work and I can count on my hand the number of times I've seen the catastrophically long lines at the gas station that I've seen at other Costcos (*cough* 44th Street I'm looking at you *cough*). There's almost never a wait and I've been during all times of day.\n\nIf you live alone and are lazy like me, you find that running out of toilet paper is a hard reality sometimes. Buying it at Costco solves the problem of quantity without draining your wallet. You'll find bulk versions of most home staples like toilet paper, paper towels, dish soap, swiffer refills and kitchen staples like coffee, juice packs, and condiments in quantities that you didn't think were necessary. But they are.\n\nCustomer service is ok for the most part but I did notice on my last trip that they have more of those independent sales contractors on site who can be kind of pushy. Otherwise, your average Costco experience and average isn't a bad thing!
o7WABjZct-u2gpBR8LXckQ	This is our preferred location because it usually has an electric scooter or even two available. My mother and I are both disabled, her more than I so she almost always gets one right away. The employees inside the store are somewhat scarce when you need help but the checkout employees more than make up with it with their speed, accuracy and above all, their pleasant manner in which they speak with you and do their job. Very happy and satisfied with this location and I drive further from my house, which is near the Sossaman store because of the scooter and employees.
o7WABjZct-u2gpBR8LXckQ	Love their all beef hot dogs, and it's so easy to sneak in there to eat with no membership!  Thanks, Costco.
o7WABjZct-u2gpBR8LXckQ	This review is for the Costco tire center at Country Club and Baseline in Gilbert.\n\nBought a set of 4 tires from them.  When I got my truck home I noticed they had removed my nice metal valve stem caps and replaced them with plastic caps.  Complained to the store and got shoved over to the "tire manager" who did absolutely nothing.  Complained again and never heard back.  \n\nHey Costco - where's my stolen property?  Do you even care?  Oh - that's right, you don't.  I gave you 2 chances to care and you obviously don't.  \n\nDiscount Tire - I will never stray again.  Live and learn.
o7WABjZct-u2gpBR8LXckQ	Places I DON"T shop:\n1. Places that make me check out my own groceries (like Fresh and Easy)\n2. Places that make me pay to shop there (Costco, Sam's Club)\n3. Places that make me bag my own groceries (Fresh and Easy and Winco)\nGive me a break. Whatever happened to customer service???\n\nOur family tried Costco for one year and decided that we were nuts to pay to shop here.
o7WABjZct-u2gpBR8LXckQ	You can't help but love the Costco gas station. The price is great, the location is good, there are plenty of pumps and they keep the line moving. The machine that takes your Costco card and a credit card is pretty easy to use and if you have a problem there are always a couple of attendants around to help you out. Good job Costco!
o7WABjZct-u2gpBR8LXckQ	The one time I forget my card they deny me any access to the card services, food court, bathrooms, nothing. My family has been part of costco for years and never had just a rude accusation thrown at me. I think we might be discontinuing our membership after this! Terrible!
o7WABjZct-u2gpBR8LXckQ	There costumer service is great. True 2 there word.help me as needed. Bath room was clean.food was hot.and good. Look forward 2 every week 2 go.less then 10mns from my door.
o7WABjZct-u2gpBR8LXckQ	I frequently this Costco alot. I usually come here to buy hard drives for work. The price is real good and seems like the Hard Drives I buy are always on sale.
o7WABjZct-u2gpBR8LXckQ	I love this store.  I have yet to have any issues here.  They have great stock.  They employees are friendly.  The food has been good.  We joke that just take the art of items you buy and multiple it by $10 and you have your total you spend for the day, lol.  We go there for the bulk items mostly and the munchies venders, lol.  It's like meals on wheels or a picnic while we shop. :)  Good Deals, too.
o7WABjZct-u2gpBR8LXckQ	What can you say about Costco. Employees seem very friendly however like all Costco locations this one is pretty busy. May choose to avoid this location as it was seriously busy.
o7WABjZct-u2gpBR8LXckQ	Who doesn't love Costco?!\n\nEach Costco varies with their products..\n\nGreat for buying in bulk or large quantities!\n\nIf you see asterisk next to the price tag that mean they are discontinuing the product. Stock up on that product!
o7WABjZct-u2gpBR8LXckQ	Aww yea, baby! By far my second favorite Costco (my first favorite one is in Honolulu and only because I can get Macadamia nut Hershey's Kisses!).\n\nThis has a gas station and...though my digestive tract hates me for it, a kick ass cheese selection. The Costco back in the 408/415 doesn't hold a candle to this Costco in cheese selection.\n\nI avoid any costco during their demo hours because frankly, I have zero desire to be shoved aside by hungry little mothers with their monster kids. I detest trying to maneuver around people randomly stopping to chat to the demo person and having their cart blocking off an aisle. Have some consideration, ok? Not all of us are there to eat!\n\nThe best perk to this Costco? It's less than 10 minutes from my house. WOO HOO!\n\nBummer they don't take other credit cards because I would love to get flight miles, but it's ok...I was persuaded to finally get an Amex and now I get back some rockin' rewards!
