business_id	text
mLwM-h2YhXl2NCgdS84_Bw	Great soul food period , it's get no better, come and get it. They have lamb too !! Chicken, ribs, bbq chicken and sides to boot !! Pure awesomeness !!
mLwM-h2YhXl2NCgdS84_Bw	South Florida resides on the east side of Charlotte inside of a convenience store....a little sketchy but the food is really good.  They serve breakfast all day(chicken and waffles, fish and grits, etc) lunch and dinner.  They are grilling chicken, ribs, and pork chops right in the parking lot and although I haven't tried the ribs, the grilled pork chops and chicken are perfectly cooked.  I also tried the fried chicken, green beans, lima beans, potato salad, stewed squash, and seafood salad...all excellent!  The only thing I wasn't impressed with was the Mac n cheese.  They also offer homemade desserts, fruit and salad.  Great addition to the soul food scene!
mLwM-h2YhXl2NCgdS84_Bw	So this place is in the c-store. A little skeptical of the atmosphere but go in the day time and it's alright.  My food was good . I had turkey wings yams and green beans.  Very good turkey wings. Yams were not to sweet just the way I like it.  Will try again.  Sometimes taking a chance works!
mLwM-h2YhXl2NCgdS84_Bw	Amazing food!! I can't believe it almost taste like my 100 year old grandfathers food, God rest his soul. Even though these guys are displaced and have opened up shop in Nubian Queens Restaurant, they did not let that come across in the food  they prepared! I'm a patron from here on out!
v2WhjAB3PIBA8J8VxG3wEg	My new ritual is drinking tea every night after dinner, rather than just in the morning. I'd never really found a good decaffinated tea that I liked; they all seemed so processed and gross. Until I ran across the Tea Emporium, that is.\n\nI was ambling along the Danforth and passed the Tea Emporium's newest storefront. The store is small, but very pleasant. As you'd imagine, it has a good selection of teapots and teacups for sale, as well as other tea-related accoutrements. \n\nTheir tea selection is outstanding. Also outstanding is the sweet employee who took a ton of time trying to understand what kind of teas I like and what time of day I wanted to drink said teas. She proceeded to open about 574 canisters so I could smell each and every one, and offered little commentaries on each one. I settled on a Rooibos herbal tea called "Rooibos Province Organic", a South African red bush tree blended with lavender, rose petals, black and red currants, raisins, and rosehip. It smelled divine and I can't wait to try it.\n\nThe teas are priced around $10.50-$12.00 for 100 grams; the minimum they'll sell is 50mg, so you do the math. I also purchased a handle-free tea cup for $7, which is important so you don't burn your mouth. Like Teavana, they also make all kinds of teas there for you, as well, from tea lattes to (real) iced tea. :-)
v2WhjAB3PIBA8J8VxG3wEg	These people know there stuff! They are not herbalists, but rather tea connoisseurs.  If you can find something the staff can not answer, They will ether try and find out for you or direct you to where you can find the info yourself. I admire this as I'm a no BS type of person. They were very helpful and friendly.\n\nThe store it's self looks cozy and inviting. It smells amazing as soon as you step in the door. I'll be returning soon.  :)
v2WhjAB3PIBA8J8VxG3wEg	Yes another tea place with a zillion varieties of loose leaf tea.\n\nI love the concept, don't get me wrong, but I just can't justify giving any of these place ridiculously high ratings because they are just all so similar and thus only A-OK in my books.\n\nThe Tea Emporium is a bit more old fashioned and kitschy looking, when compared to say, the David's Tea chain. They had lots of tea but not quite as many tea "accessories". \n\nYou can order single takeaway cups for $2.05. I tried an apple tea variety and it was ok. There's not really any seating inside so you'll have to get your tea to go.
v2WhjAB3PIBA8J8VxG3wEg	Having recently discovered the joy of drinking a delicious tea on a chilly day, stepping into this place early last night, on my way to dinner with a bunch of yelpers, was in a word fantastic.\n\nTea Emporium has an amazing selection of teas on the menu to enjoy freshly brewed on the spot, or take out...or you can buy their loose leaf teas to take home and enjoy.  Their menu of tea offerings seemed endless and believe me, I wanted to try them all.\n\nDuring my visit there last night, I ordered the Rooibos Vanilla and it was quite possibly the most delcious tea I've ever had...however, I also spotted another tea, African Queen, which I cannot wait to try next time I stop in.  It's more the likely to rival the one I had last night...can't wait!\n\nThe store itself is small, but very welcoming and nicely decorated.  They have a few seats for folks to sit and enjoy their tea, but I can't imagine it woudl accommodate more than 2 or 3 people comfortably.  The girl who served us was really nice and the ambiance was quite pleasant.\n\nIf their selection of teas isn't enough to make you a fan then you will certainly appreciate the beautiful tea cups and teapots they also have on offer.
v2WhjAB3PIBA8J8VxG3wEg	I'm a tea freak.  I've got about 40 or 50 canisters/packages of tea. Bagged tea/loose leaf.  I've got tea accessories.  I've got books about tea. I dream of doing a tea tour of Holland and Russia.   I like tea.\n\nI've been used to going to Chinatown 3 and Kensington and St. Lawrence Market for my tea hits.  Or NYC, but that's a bit of a trip when what I want is a new tea.\n\nFound this location of the Tea Emporium when a friend and I were looking for a beverage before dance class.  My friend was looking for a tea to make her MIL happy during their next visit.  I just needed tea to drink right then.\n\nThe lovely lovely woman running the shop that night directed me to the Swiss Schoko - chocolate, almonds and calendula on a black tea base.  Terrific with honey.   I started savouring while the staffer led my friend through variations of first flush Darjeeling (ranging in cost from about $15 - 50/100 gms - at the high end, they will sell 10 gms).  Terrific service and advice.  \n\nI'll be back at least once a week for a tea - and an occasional top up of a tea canister or two.
v2WhjAB3PIBA8J8VxG3wEg	As another recent tea convert, trying to break my afternoon coffee habit. An afternoon pot of their "Royal Earl Grey" made in a cheap and cheerful infuser from a local kitchen shop, and the world honestly comes more alive. It has got to be the most delicate and perfectly blended tea I have ever had. \n\nThey also have a 'creamed' Earl Grey, which I have yet to try, but I am working my way through their Chai teas one by one.\n\nSomething nobody noticed to say, is their actual tea. After the pot is done, I am always amazed at the complexities of the actual tea, once it is plumped back up. It's a virtual garden in most of them, and from what they said, they blend most of their teas themselves, by hand.\n\nTheir craftsmanship shows.
v2WhjAB3PIBA8J8VxG3wEg	I've been going to the Tea Emporium for years.  They are the ones who introduced me to tea in fact :)  The quality and the selection of teas here are just spectacular both for flavoured and non-flavoured teas.  This is a place for a real tea connoisseur -- David's tea is a fun place but the quality of the tea here is simply better.  The flavoured teas have better ingredients and the taste is not as chemical and in your face as David's tea (don't get me wrong I actually like David's tea for some teas but as a rule Tea Emporium has a lot more of really spectacular teas).  For non flavoured teas this shop wins hands down.
n33Izvzk_z9_51H6NsQF-A	Count your fingers after they hand you a receipt.  I shop here mostly for meat. Started using their app for the Just for U deals.  3 out of 4 times they overcharge me (I don't get the coupon price or they give me the price and charge me for more units than I place on the belt).  I then have to wait at the customer service counter for a refund while the customer service person tries to convince me I was correctly charged.  Last time they gave me a cash refund but rounded down and stiffed me for the tax I paid. Nuff said.
n33Izvzk_z9_51H6NsQF-A	Had a misunderstanding with a cake design when picked up a cake. The bakery manager really took charge and made my cake amazing and what i wanted!!!  Great place to get custom cakes!!!!!
n33Izvzk_z9_51H6NsQF-A	General okay but no fry's when it comes to price and always have to wait in line. If no line you will probably have to ring a bell. Lol
n33Izvzk_z9_51H6NsQF-A	I sometimes stop at this Safeway because it is convenient. The reviews I have seen are correct, they need more staff (or) to staff at the appropriate times when it's busy. The lines are always super long and their customer service does lack. I do feel bad saying it lacks as the checker's are normally just as frustrated as the customers due to the never ending lines. \n\nI did also have a small incident with Pom Pomegranate Seeds (Pom is the brand.) I normally check all my expiration dates on anything that is perishable because there is nothing worse than pulling something from the fridge to eat it and it's gone bad. Anyway, I was in a rush and didn't look when I bought these and of course they had expired the week before. I will give it to the customer service desk, I took both tubs in that i bought the evening before and she promptly gave me my money back. Moral of this story: ALWAYS check your expiration dates. I was pleased with how she handled the return though, she did not give me any push-back which was a nice surprise. \n\nIf the management team can figure out the right number of checkers during certain hours this would definitely help their rating and my frequency for shopping here. \n\nSometimes a girl just don't have time to wait in long lines.
n33Izvzk_z9_51H6NsQF-A	I keep going to this store because the customer service is spectacular for a grocery store. They go above and beyond to assist and help you out in anyway - they always ask if you need help finding anything - they offer assistance with carrying items - very knowledgeable of their store and where items are located.\n\nContrary to popular belief Safeway actually offers some of the best deals on grocery items I have seen compared to the other stores around my area such as Wal-Mart/Albertsons/Bashas etc. - They stay very competitive. I'm not sure how this store doesn't get a better rep? Customer service is really their number one goal, so if you have a problem don't be afraid to say something because they will help you solve it without belittling you such as what happens at most Wal-Marts. \n\n@Max C. - The checkout experience can be a little slow at times especially if you go to this particular store after 8pm and they don't have any self checkout lanes but they try to make the best of what they got. They also read your last name after finishing the order because it's trying to show you that they care, it's the little things that matter, if that is a bother for you then please head over to Wal-Mart.
n33Izvzk_z9_51H6NsQF-A	This place rarely has enough staff working.  Too many times, usually in the late afternoon on the way home from work, the longs are soooo long.  The rarely have more than 2 lines open meaning it is longer to get out of the store than it is to shop.  Never see the manager working nights to witness this operation.  I am afraid management is looking at sales reports and filling out the schedule based on numbers.  Unfortunately, customers are working out without buying anything once they see the long lines.\n\nHate shopping at this Safeway.
n33Izvzk_z9_51H6NsQF-A	I avoid this place like the plague.  They are always slow in the check out area.  Rarely are more than 2 lanes open.  The parking lot is a mad house.
n33Izvzk_z9_51H6NsQF-A	Horrible !!!! Only 2 lanes open and 5 people deep. I asked for another lane to be open and that took another couple of minutes total time in line 12 minutes. This is not the first second or third time this has happened it's every time I go in there. The management fucking sucks!!!!!! I asked to see the manager and he pretended to be oblivious to the situation.\nI asked him if he ever reads the store reviews and again he had "no clue" what I was talking about. This place is fucking ridiculous !!!! And definitely needs new management.
n33Izvzk_z9_51H6NsQF-A	Terrible NEVER USE SAFEWAY GROCERY DELIVERY! \n\nMade an order, it never got delivered and per Maureen with Safeway Grocery customer Service my order was cancelled doesn't know why, but it was cancelled. Nothing they can/will do about it! TERRIBLE CUSTOMER SERVICE. Oh and I was told yea we see you used a promo, you won't be able to use it again. Sorry wish there was something we could do....... NEVER AGAIN WILL I MAKE THIS MISTAKE! I will stick to shopping from FRYS food store and just do my order pick ups there! They don't let their customers down! They don't cancel orders for no reason, they have resolutions for their customers!!!
n33Izvzk_z9_51H6NsQF-A	So it's not the most glamorous Safeway, but it's also not the worst. Its decent, average in size and close to my place! Friendly staff.
n33Izvzk_z9_51H6NsQF-A	I really like this Safeway. It seems to be well organized and the selection of foods are pretty good. The last time I was here I got something from the hot case to eat for dinner and the fried chicken was okay. Nothing exciting. \n\nIt does almost never fail to be long lines when I am ready to check out...except for that one time I went after 10pm.
n33Izvzk_z9_51H6NsQF-A	Good enough selection for just about anyone and overall a very clean place.  Service was very friendly and accomodated all requests.  Conveniently located near home nested with a variety of other stores in the same shopping center.
n33Izvzk_z9_51H6NsQF-A	This store sucks!!!!\n3's a crowd is crap. The only reason I went there because close to me\nI waited in line longer than I shopped\nRather drive 5 min down road to frys market place.   Nobody apologized for 15 min wait for a one item check out
n33Izvzk_z9_51H6NsQF-A	I can't tell you how many times I've been in this store when they had a line of customers at the ONE register they have open.  One evening I stopped after work and ended up in a line nine people long!  They did finally open one other register that time.  It's always slow, there's almost always only one register open and they don't have any self check-outs.  After 8 years of living here and coming to this Safeway periodically I think I'm done with this store.  There are 4 other grocery stores within 2 miles, don't waste your time here.
n33Izvzk_z9_51H6NsQF-A	Absolutely HATE this safeway ..besides the fact that they are way understaffed & it's taken me as long as 20 min to check out ..they have the rudest cashiers I've ever seen ..and lazy !\nI only go here if it's a emergency! !!
n33Izvzk_z9_51H6NsQF-A	I want to say first I am not from his area and when I saw a Safeway I was happy because I know I have a Safeway card and I can use the just for you app. Not a problem. The place is beautiful.!! They need a better selection of food. I guess its just for that "area" but again it was not far from my new apartment. Now the Starbucks workers in there are very selective with who they speak to. Its like they were afraid or something. That automatically turned me off. Not to mention the cashier wouldn't even speak to and the girl who was bagging even walked away. I kid you not!!! I will go to the one that is even closer to me off Alma Rd their customer service sucks and that's all I need not to go. It was my first and last time. Safeway needs to do something about that.
n33Izvzk_z9_51H6NsQF-A	All the complaints about this Safeway being understaffed stems from the management being so awful to their employees. They have huge turnovers, people are hired and quit sometimes after their first shift. I did about three weeks of being talked down to, general rudeness, reminded that I could be fired at their whim...just an awful place to work. I found another job and purposely quit 10 mins before my next shift, it felt good.
n33Izvzk_z9_51H6NsQF-A	I love Safeway in all ways except this one lacks in customer service.\n\nSafeway offers coupons plus bonus $5.00 items on Friday's!\n\nThis particular location has several customer service cashiers that lack happiness as I call it. Regardless of the day or night, they never seem happy and pleasant. I also don't like the fact that I have to wait in line regardless of the time of day. They never seem to have enough cashiers on duty. Weekends are the worse!\n\nHope it's just this location and not the norm!
n33Izvzk_z9_51H6NsQF-A	Checkout experience is very poor.  Never enough lanes open and I hate their policy of reading the customer's last name out loud when they give you the receipt.  My last name is no one's business!  Please stop doing this!  Major privacy violation!\n\nOn a positive note, the organic produce section is quite good and the only reason I shop here.
n33Izvzk_z9_51H6NsQF-A	We really like this store, but the lack of checkers is really becoming an issue. This Sunday there were 14 people in line and one checker. It literally took 20 minutes in line. This is the case every time we go. Management is trying to save money on checkers, but they qill end up losing customers. It's to the point that we are thinking about changing stores.
n33Izvzk_z9_51H6NsQF-A	Every time we go to this location they're slow. Ordered two sandwiches from the to go sandwich counter. Only customer in line and it took the kid over 20 minutes. We went to check out in the express 15 item or less line and it took about 15 or 20 minutes for him to check out 3 people with credit cards and cash ready. I watched people leave my line, go into the regular lines and still beat me out the store. The clerk obviously did not care it was written all over his face. Went another time and just had to get something from the customer service counter and waited 7 to 10 minutes before I asked if anyone was working the counter and they finally sent someone my way about another 5 minutes later. Again people behind left in anger about the wait. Great store but the slowest staff and it's every time we go.
1cLXGXThDYZ5WK_KpBLtkw	I'm in town visiting family and was doing some research to find some cute little cool spots to grab some snacks from. Let me tell you, I'm so glad I came across this place!\n\nI walked in and was blown away at the selection they offer. Everything from buns and pastries, to bubble tea and rice dishes. They have something for everyone! \n\nI came in and grabbed a few BBQ pork buns, a taro pastry, a red bean bun, and a beef curry pastry. So far I've inly tried the BBQ pork bun and beef curry pastry. Both are excellent and have a lot of filling! The beef curry pastry reminded me of a Jamaican beef patty. Really good stuff! I also got a Thai tea with boba. I thought it would be authentic but all of that stuff is just powdered. It's still good though. Give it a try! I walked out with 5 buns and a Thai tea for $11 and I'm stuffed.
1cLXGXThDYZ5WK_KpBLtkw	A sophisticated asian bakery with homemade pastries that have an artistic touch. I had a strawberry filled bread roll and it was good. The bread was fresh and the filling was real but it did not exceed my expectations. I also had the mango bubble tea and I was disappointed! The tea balls were gooey and the taste was just off. However, I like this place for a quick treat that is also pretty to look at!
1cLXGXThDYZ5WK_KpBLtkw	The only Chinese bakery in Cleveland and it is pretty good.
1cLXGXThDYZ5WK_KpBLtkw	I have to say that because koko bakery doesn't have any competitors, it's hard to really compare their goods to others. CLE, I hope you step up your game because we need more Asian bakeries here!\n\nWith that said, I am grateful that we even have one bakery to get goodies from. Their breads are not bad, and it's better if you come in the morning when they are freshly baked. I usually get the beef curry bread, and the BBQ pork bread. These are kept in the smaller display case to left. \nThe other breads are also good, so don't feel shy about giving everything a try. Also, they have the best boba I've tried thus far in CLE. If only we had more to choose from...sigh. The prices are higher than what I'm used to seeing in Asian bakeries, but it's worth the $ to fulfill your cravings!
1cLXGXThDYZ5WK_KpBLtkw	As all my fellow yelpers know,\nI was craving a pork bun like WHOA!\nI got lots of recommendations from ya,\nLike Park to Shop, Bo Loong, and Li Wah.\nBut then along came the description of Koko,\nAnd I knew that's where I'd go.\nKinda nearby, on 37th and Payne,\nTook the Focus and Yelpette there in the rain. (Er, snow.)\n\nOnly had Bubble Tea once before,\nThought I'd try it again--it's what Koko's known for.\nTapioca pearls, chewy, creepy and round,\nWith a Thai tea flavor--it was pretty sound.\nGot two BBQ pork buns like I'd come in for,\nGot 'em wrapped to go and was out the door.\nService was friendly, people were nice,\nThe showcases stocked full of sweets to entice.\nI'll return someday soon, that much is true,\nAnd thank you Koko for my 300th review!
1cLXGXThDYZ5WK_KpBLtkw	Pros\n- large buns\n- generous filling in the buns\n- great price!\n- great flavor\n- friendly service\n- good variety \n\ncons\n- they should be served warm, but we took them home to warm them up and they tasted great
1cLXGXThDYZ5WK_KpBLtkw	This is my go-to place after I've had lunch at one of the many Asian restaurants in the area.   I  usually stop on Friday, in order to stock up on goodies for the weekend.   There are a variety of stuffed buns (still working my way thru each type...lol!), all displayed and labeled nicely.  There are also a small selection of stuffed buns and turnovers, held in a warmer directly next to the display case.  Everything is fresh, colorful.  There is a bakery case with sweets next to the register, brownies, tarts, mousse, cakes, pastries etc.   In addition there are items packaged "to-go" on shelves around the bakery.  My favorite items are the almond shortbread cookies (toasted almonds in a fresh shortbread cookie...yum) and the dinner rolls....kinda reminds you of Hawaiian rolls, only better!  There is also a small foods menu with salads, rice bowls etc., which I haven't had the opportunity to try yet.  I love this place and looking forward to continually sampling all that it has to offer!
1cLXGXThDYZ5WK_KpBLtkw	I have had better manapua (pork buns) in Honolulu, better rice bowls at Tensuke in Columbus, and I have had worse cakes in DC and worse service in LA. However, Koko has things in its favor that far exceed Asian bakeries in LA, DC, NYC and any other city that uses initials. First, the owner is a gem. She is friendly, generous, funny and knows how to cook and bake. \n\nSecond, you can find everything here. No need to run to a bakery, then a tea house, then a cafe, then a restaurant. Koko has all of this along with bubble teas. Being of a generation where bubble tea is as attractive as Kool-Aid I can make no recommendations. I can recommend the strawberry cake, the rice bowls and wide selection of buns and bakery. You would have to be a very hard to please person to not find things you like and I mean like a lot. \n\nI cannot be close to Koko's and not run in. Friends know a typical lunch at my house is a big bowl of home made ramen and pork buns from Koko Bakery. A frequent desert is a slice of a Koko strawberry cream cake. \n\nThank goodness Koko is in Cleveland as it saves me a lot of traveling when I crave a manapua.
1cLXGXThDYZ5WK_KpBLtkw	So, I'm mad at my mom because she's been going here for forever and I haven't even heard about this place until today...Like, "I'm so mad at you, Mom, because I feel like you've kept this wonderful place a secret and even more peeved that you've never brought home any goodies for me." \n\nBut, I instantly forgave her because 1. We came here and she showed it to me eventually and 2. Delicious enough treats never last car rides long enough. \n\nFricking: boba teas, lattes, savory and sweet filled buns, desserts, etc. So many goodies, so little time. Come here early when everything is stocked to the brim and made fresh. A great after dinner spot, quick breakfast, or a place to gab with someone for a while.
1cLXGXThDYZ5WK_KpBLtkw	Koko's is a favorite stop of mine when in Asian Town of Cleveland. Their delicate flavored buns and donuts are wonderful. We'll generally buy a smattering of a little of this and a little of that--frankly we are quite fortunate to have such a high quality Asian Bakery in our midst. Just one more fabulous place in Cleveland! My favorite is their cocoa red bean filled bun. You'd never know the subtly sweet ingredients inside was a bean paste--a red bean paste, I think, which means, they're not bad for you, too! :-)
1cLXGXThDYZ5WK_KpBLtkw	I thought I walked into a bakery in the San Gabriel valley.
1cLXGXThDYZ5WK_KpBLtkw	The coconut pie, Curried beef donuts were awesome. However the bubble tea I did not care for at all. I got the lychee bubble tea but it was brown and tasted anything but like lychee. The bubbles were good but only got like a tablespoon of them in the glass. And almost half the glass was ice... so not impressed with the bubble tea. I don't think they used a lychee concentrate to make the tea.. they are using canned juice, which doesn't taste good at all. \nI'm only giving it 4 stars because the rest of the bakery stuff was good.
