business_id	text
1cLXGXThDYZ5WK_KpBLtkw	I am very picky about desserts and pastries, and even pickier about iced coffee.  KoKo bakery satisfies me.  Whether you are craving a savory snack, sweet boba milk tea, or a more filling option, KoKo Bakery has it covered.\nFirst, it's clean and bright...no odd smells, no trash on the floor.  This cleanliness even extends to the nice parking lot.  \nI have only had coffee drinks at this place in the past...they're excellent.  \nIt may be confusing at first to newcomers at how you get the tasty pastry or pork bun that you've been eyeing in the tall display case.  I was standing there, selecting a BBQ Pork Bun to take home when a customer approached and sheepishly asked me if we indeed served ourselves or do we place the order at the register?  I told him that I watched some others pick up a tray, place a sheet of parchment on it, then opened the display case and select the items they wanted, placing them carefully on the paper with the provided pair of tongs. So this is how I did it, too.\nAnyway, after selecting the pork buns (which have a TON of flavor and filling), I went to the register and ordered honeydew boba and strawberry boba milk teas, a brownie, and custard tart along with a BBQ pork bun and pork filled pastry.  All of the bakery was to-go...and the cashier was very sweet and put each piece of bakery in a little clear plastic bag and then sealed it!  This was really cool, because then it won't get stale before you can enjoy it.\nThere is a minimum amount of $5 if you are going to charge anything on a card.  So, keep this in mind.\nThe customer service was great, and with smiles and "thank-you"s.  \nI really like this place, and the quality is excellent!  The best Asian bobo milk tea and bakery in the area.  The boba milk tea is light, fruity and sweet, and the tapioca balls are large, soft, and chewy.  There's a lot of fruit flavor...and it doesn't taste artificial (it may be!). They also have phenomenal iced coffee, Vietnamese-style.\nAnother thing: they are closed every Tuesday!!
1cLXGXThDYZ5WK_KpBLtkw	-Friendly service.\n-Hot and cold bubble teas with extensive menu\n-Sometimes the bubble tea is way too sweet for me though, even if you ask them to make it less sugary.\n-Lots of pastries, buns, and snacks to choose from\n-The cakes on the front table look very appetizing, but sometimes they look better than they actually taste\n-Credit card accepted for purchases over $5\n-They do a good job for Cleveland, but if this bakery and bubble tea place were in some place like San Francisco (or even Arizona) I probably wouldn't go here for my bubble tea fix.
1cLXGXThDYZ5WK_KpBLtkw	Went to this place when they were at Their old spot and it was good.... Been to this new spot and I will say it's comparable to how I've seen the Asian bakeries these days if not better... Definitely deserved 5 stars because they stepped their game up.... I just try new pastries every time I go and enjoy.....
1cLXGXThDYZ5WK_KpBLtkw	Great pastries! The owner gave me some to sample too ; ) Great lunch spot.
1cLXGXThDYZ5WK_KpBLtkw	I just love Koko Bakery, especially their Boba, er,  Bubble Tea; definitely the best selection of Bubble Tea I've seen in Cleveland.
1cLXGXThDYZ5WK_KpBLtkw	Pretty good stuff, but very overpriced.  Stick with what they prepare. The apple squares that sell for $2 everywhere else are $4, rubbery and barely thawed.\n\nThey seem to pay attention to cleanliness - and they never touch your food.
1cLXGXThDYZ5WK_KpBLtkw	I was severely disappointed with Koko Bakery and will never go back.\n\nI ordered a vanilla latte off their list of several espresso drinks. The staff grabbed a cold cub and scooped powder into it, I repeated that I wanted a hot latte.  She grabbed a hot cup and poured drip coffee from a dispenser.  I asked her if the latte will have espresso in it.  She had someone else show her how to use the espresso machine, and put normal coffee grounds into it, then made a Pyrex pitcher full of coffee from the machine, that she poured into my cup.  She then asked me if I want cream in my coffee.  I told her that a latte is made with shots of espresso and steamed milk. She poured cold milk into it and handed me the drink.\n\nI took a sip, it was definitely not a latte.  I asked them to make me the correct drink or refund me the money.  She refused to refund the money because I took a sip and said that she made me the drink.  I instructed them to take lattes off the menu if they don't know how to make espresso drinks, and had my money refunded promptly by my credit card company. \n\nHorrible customer service and completely unacceptable attitude towards their customers.  A perfect example of how businesses should NOT treat their customers.  Stay away.\n\n-----------------------------------\nExplanation of my rating system -\n5*: Epitome of something, the best I've had, would LOVE to go back\n4*: Great food and happy to go back regularly, but not the best of the category\n3*: Food is fine.  I may spontaneously decide to go there based on convenience.  But no need to go back either.\n2*: If you insist, I guess I'll come along. I'll find something to eat. But I wouldn't have picked it.\n1*: No plans to come back.  I'll try to talk companions out of going.
1cLXGXThDYZ5WK_KpBLtkw	The bubble tea is pretty good. I really liked the cute cartoons on the cup. It is a strange drink. I have tried a lot of the different sweets here and enjoyed them all. The fruit parfait is one of my favorites. It is almost a solid pint of fresh fruit (mango, kiwi, strawberry and others) for around $3. The baked goods are great. I was full after eating a meal next door at Map of Thailand and could not resist coming in here for a desert. The service is excellent and I always enjoy the international music playing. One of my favorite bakeries.
1cLXGXThDYZ5WK_KpBLtkw	This business is amazing.. yes they are a bit pricey.. but after being there a few times and getting to know the staff they really have a passion for these baked goods and make things very fresh. They have the biggest chocolate covered strawberries I have seen by far.. They dial back the sweetness too as to a lot of asian bakeries do, and I mentioned something about it and how impressed I was that is was just a wonderful blend of flavor and not too crazy sweet and the owner was very thankful and super sweet. I have had nothing but great service there, even had the owner cater to us and clean up after us herself which she did not have to do we would have done it ourselves. They have board games there and just a wonderful atmosphere.
1cLXGXThDYZ5WK_KpBLtkw	With all the bad reviews on customer service, I was ready to have my head bitten off as a small offering for some Asian pastries.\n\nInstead, I was happily surprised to be helped by a young, quiet and cheerful girl. I selected my breads from the cabinet and she sealed them all individually. I ordered an iced Vietnamese coffee with boba. The boba itself is delicious, but as other reviewers have pointed out, it's a powdered drink. I was a little disappointed in not having a legitimate Vietnamese coffee. But it was drinkable, and I enjoyed the baked breads I got. The chocolate bread had a filling with a strange consistency--I ate all the bread and pulled out the filling. The cream bun was moist and soft, filled with a sweet cream that was superb. \n\nThey offer sweet and savory breads, and lunch items, like teriyaki and katsu. They also have an assortment of cakes and cookies. I'd return for more of the breads and maybe tea or a smoothie instead!
1cLXGXThDYZ5WK_KpBLtkw	After a long afternoon of shopping at the local asian food markets, my friend and I got hungry. Searching for a quick snack to wrap up our shopping without being hangry.\n\nI would have loved to buy more but after shopping, I limited myself. We both got vegetarian sticky rice that was heated for us. Inside the banana leaf was the best sticky rice ever. With soft almonds and chestnuts, perfect snacky. The cashier also pointed to some pastries that were fresh out of the oven. How can you resist fresh pastry? The red bean pastry was very uniquely delcious!\n\nWill deffinitely be making another stop there when I go to shop in the area again. This time i will bring more money!
1cLXGXThDYZ5WK_KpBLtkw	We come here for the Bubble Tea because unfortunately, this is the only  place where we can find "real" bubble tea around here. The pearls are a hit or miss. Sometimes they are the perfect texture, sometimes they are undercooked and hard in the middle. Yeah, I'm a bubble tea snob, what can I say. We like the Tarot flavor, kinda heavy but fantastic.\nAs far as the bakery goes, the cakes look nice, but if you have ever tried good asian cakes, these just don't do it. Kind of flavourless.\nBut like I said, they look pretty.\nThe bread is good though, quite authentic and are comparable in price to Van..\nThe owner is super nice...she obviously loves what she does!
1cLXGXThDYZ5WK_KpBLtkw	I never write reviews BUT I'll make an exception this one because I am tired of having the workers that rarely speaks English and understands English to take my order. Numerous times they've done my orders wrong and when I tell them they smile and say thank you. Seriously? I don't mind Asian workers but atleast someone who speaks and understands English.
1cLXGXThDYZ5WK_KpBLtkw	Their boba is alright.  I probably will not get it again.  The pastry that I tried was pretty good. Atmosphere is nice, music was a bit loud.  The service was fine but nothing exceptional.  They did have a good selection of pastries and breads.  There is a ten dollar minimum on cards.\n\nI will be back to try the steam buns!
1cLXGXThDYZ5WK_KpBLtkw	This is THE staple Asian bakery for anyone living in northeast Ohio. Their bread is made fresh daily and they have a very wide selection, ranging from the ham and egg bun to the sweeter chocolate custard bun. They have a definitive Taiwanese influence in their buns, yet they have a unique style to their buns that makes the bakery stand out from a lot of other Asian bakeries I have been to in the United States. I have gone to Koko Bakery almost every week since I moved up to Cleveland and the bread has not gotten old to me even after nearly 10 years of service. Koko Bakery's bubble tea and desserts are comparable to what you can get at other Asian places - still pretty good, but nothing exceptional. However, the buns that you can get for $1-$1.50 definitely stand out to me as something you can't get anywhere else, and this is why Koko Bakery deserves a 5 star rating.
1cLXGXThDYZ5WK_KpBLtkw	The tea was sickening sweet. I wanted traditional black tea with tapioca pearls. $7 down the drain and two teas in the trash.
1cLXGXThDYZ5WK_KpBLtkw	My favorite bakery!  The best whipped cream cake, reminding me of the ones at Ruby Bakery in my hometown Shanghai.\nI love almost all the pastries there!   But do stay away from their lunch menu.  My husband ordered teriyaki beef and rice which is a frozen dish, heated by microwave oven.
1cLXGXThDYZ5WK_KpBLtkw	Beautiful cakes and deserts! But my favorite is the bubble tea. Inside have some tables to sit.
1cLXGXThDYZ5WK_KpBLtkw	I have ordered lunch here a few times. Each time has been great. I highly recommend the Pork Kutsu sandwich. The portion sizes are huge and the prices are cheap. You must try the bubble teas. You can even get delivery on Skipthedishes.com.
1cLXGXThDYZ5WK_KpBLtkw	Cute shop with yummy pastries! I love the coconut almond pastry, the BBQ pork buns (although very sweet) and the red bean buns. \n\nAnother great thing to know is that they do sell to-go buns! I always end up buying a bag of those.\n\nCoffee is decent, but the bubble teas are a must.
1cLXGXThDYZ5WK_KpBLtkw	This is definitely the best Chinese bakery and bubble tea place in Cleveland.  The buns are very delicious and they serve a variety of nice lunches - my favorite is the wasabi turkey club sandwich.  The owner and workers are very friendly and they offer free wifi, which means that I sometimes will hang out here all day and use this as my second office.
1cLXGXThDYZ5WK_KpBLtkw	This might be the only legit Asian bakery in the Northeast Ohio area. The pastries are delicious! I especially enjoy their BBQ pork buns and egg tarts. They also have different flavors of tapioca drinks, the sweetness of which you can customize. \n\nI've tried many of the items here, and I've always enjoyed it.
1cLXGXThDYZ5WK_KpBLtkw	I almost cried while I found out KOKO Bakery. Every time I miss home food, I will come here. There are many traditional Taiwanese foods there. I have been known this place for a long time. When I were a college student, I like to order a drink, have a bun or bread and stayed there for studying. The place is wifi-free. They display Chinese popular music which makes me feel I am back in Taiwan. The place is pretty clean and bright. Fresh bread is baked every day. My favorite is turkey sandwich which has egg and turkey folded in the bread. I also like Green onion, dried pork or sweet red bean one. Steamed buns are unbelievable. My recommended one is the big meat bun. It has so many things inside include pork, sausage, Chinese mushroom, egg... The birthday cake is made by the same day I ordered. There are a lot of choices to pick for filling in the birthday cake and it is not that sweet which is perfect to me. Cheesecake is soft and light and my friends love it. Drinks are various there. My favorite one is bubble milk tea. However, I always cut sugar half because I do not drink too sweet. Fruit or coffee smoothies are great. Taiwanese shaved ice is good choice in the summer time. Price is reasonable. The owner is really really friendly and nice. How wonderful it is that Cleveland has a place like KOKO Bakery!
1cLXGXThDYZ5WK_KpBLtkw	They also make breads...I really like the coconut cream bread. Their sugar donuts and the chicken steamed bun are yummy too. Really want to try the shave ice but ya know it's been freezing lately. Next trip will try a teriyaki bowl.
1cLXGXThDYZ5WK_KpBLtkw	This place does a fairly good job with its fresh pastries and buns.  Their meals are also decent as well.  The service from the owner is excellent, I walk away with a free sample more often than not.  That said, the boba is incredibly overpriced (almost $4 for a relatively small cup) and is really hit or miss with the quality.  Having lived in California and also had boba in Taiwan, I only come here when I'm extremely desperate for boba tea and have extra spending money.
1cLXGXThDYZ5WK_KpBLtkw	Koko Bakery reminds me a lot of Asian bakeries back home in Southern California. I love stopping by here every time I'm in the area and stock up on some delicious Asian pastries :) \n\nMy favorite pastries include: \n- Pineapple bun (bo lo bao): Very crispy layer of pineapple-flavored crust on top of a piece of bread. \n- Crispy bun with sour vegetables and pork: this sounds very unappetizing, but trust me, it is bomb[dot]com :D\n- Pork sun rice roll: this is like a large sushi, with pork sun in the middle! I love pork sun in anything, so this was pretty much a given. \nAll of the pastries are priced around $1, so they're very affordable! \n\nThis is one of the few places that sell bubble tea in Cleveland, which kinda sucks :( I loved getting my weekly fix of boba back in LA, but Koko just doesn't do it for me, unfortunately! I've gotten the taro, Thai, Hong Kong, strawberry, and honeydew milk teas. All of them were hugely disappointing because they were just too sweet. Even if you add in more ice, the oober sweetness does not go away :( I guess I'd just have to wait until I visit Southern California to get some authentic milk teas! Despite this, I still love coming here for the pastries :)
1cLXGXThDYZ5WK_KpBLtkw	I do not write many reviews but I think I need to share this with others so everyone is aware of and be on guard for it.  \n\n I have ordered their mango cake several times is it is far great and my family loves it.  We have also ordered their buns and other deserts with very little complaints.  I would question their drinks and service there.  I have placed orders for mango cake in advance several times and 4 out 5 time I have been disappointed with their services.  On several occasions I had to wait on my cake for several hours because they gave my cake away or pretend I have never order it.  I would wait in line and ask for it they kept on telling me it is on it way and when it came out from the kitchen they stick it in the display case instead of boxing the cake and hand it to me.  Instead they would continue making all the drinks for the 5 customers that were in line and I continue to wait for my cake while being ignored.  Now I already spent over $100 at the shop and I was in line first waiting on my cake but they continue to serve the individual customer who are only buying stuff that comes up for less than $10.  Terrible! \n\nThey latest incident was on Christmas Eve.  We order a cake and they suggested that they would make make one with more fruit layer on top of my cake but instead they only applied fruit on the perimeter of they cake.  Also my family order bubble tea and in one drink it had a funny taste and we took a sip and told the ladies at the counter that it did not taste right.  Their reply was to buy another one.  I was so pissed off at them and we just left. \n\n My whole family (My mother, uncles, aunties, and cousins, and my wife and kids) have decided to boycott them.  We refused to treated unfairly.   We loved good food but customer service is also goes a long way.  Koko Bakery does not get any love from my family.\n\nI am a Chinese American and I am proud of it
1cLXGXThDYZ5WK_KpBLtkw	I pretty much come here when I'm desperate for milk tea. They do make their milk tea out of powder and charge you 3.45 for a regular and 4.50 for a large (+tax, of course). If this place was in California, it wouldn't survive at those prices for powdered milk tea. It's on the sweeter end of milk teas, so for these reasons, I recommend going to CSU China Sea for their milk tea if it's more convenient. Unfortunately, my parallel parking skills would likely end in some fender benders and suddenly, that milk tea that I so craved is going to cost a couple thousand dollars. So I come here.\n\nThe bakery items are ok. I come here a lot towards closing and per my knowledge/experience they don't offer any sort of special (BOGO or half off) after a certain time. Which is a shame since they tend to have 1-2 trays left at the end of the day and it'd be so nice to have a bun for breakfast in the morning.
1cLXGXThDYZ5WK_KpBLtkw	This place was "aight" there needs to be higher boba stands. This wasn't as good as it "could" have been.
1cLXGXThDYZ5WK_KpBLtkw	Cheap and tasty. What more could you ask for? Free Wi-fi and outlets. Oh wait, they have that too!\n\nKoko has a great selection of typical Chinese/Taiwanese/Hong Kong style pastries, both sweet and savory. You can even purchase packs of frozen buns in preparation for those long winters! There's a $5 minimum for card, which you shouldn't have too hard of a time doing if you get something for here and something for the road, or bring along a friend. So far, I've stuck mostly with the pastries/buns and everything has been pretty good except for this strange sweet and savory cake thing with pork sung, green onion, and custard... Not sure who made that up but it's not working too well. My friend is a big fan of their savory rice rolls, and one day I'll indulge in one of their too-pretty-to-eat desserts in the refrigerated case. I'm looking at you, mousses.\n\nIt seems like they keep baking throughout the day rather than finishing in the morning, so you'll frequently see trays of fresh bread sitting out on various tables. It's tempting, but try not to steal a nibble.\n\nTheir milktea drinks are hit or miss - some are really sweet and some seem to be heavily artificially-flavored. They have a pretty unique list of flavors - choose wisely! I've also tried the Hong Kong coffee, which is basically all the types of sugar and cream you could think of mixed with coffee, but surprisingly didn't keep me up until 2am. \n\nTwo bathrooms are located in the hallway beyond the door next to the buns. Nothing special to see here, just do your business and go enjoy your treats.
1cLXGXThDYZ5WK_KpBLtkw	I love Koko! Vegetarian and meat options for a light, inexpensive lunch. My veg favorites are the vegetable and cheese bun from the bakery case, and the tempura fried vegetables from the kitchen. Taro buns and almond rolls for dessert! Comfortable atmosphere with ample seating and a friendly staff. I've never had a bad experience here.
1cLXGXThDYZ5WK_KpBLtkw	This is the only place I have found in Cleveland that has real rice bowls... the simplicity and deliciousness of katsu on rice -  in a bowl!  Needless to say, I was very happy with my lunch.  As for the boba (bubble tea) - it was okay.  I firmly believe a milk tea with boba should not cost more than $3 (maybe $3.25), but for now I will support it since the tea was decent and boba is too hard to find in Cleveland.  I just wish they were open later!
1cLXGXThDYZ5WK_KpBLtkw	If there were a "zero star" option, I would have selected it.  Koko Bakery's cake is delicious - so delicious that we chose it for our wedding.  I live in Columbus, but got married in Cleveland.  I did some research to find a Chinese bakery similar to one in Columbus.  When I found Koko, I was thrilled.  I spoke with the owner, Jessica, several times before I made a special trip to meet with her and try the cake.  \n\nOur appointment should have been our first warning.  She was over 30 minutes late and not apologetic.  Nevertheless, we loved the cake, so we decided to make arrangements for our wedding.  Jessica told us she would get back to us with a quote so we could pay a deposit.\n\nWeeks go by and still no word.  We become nervous and leave message after message.  When we do get a hold of Jessica, she makes excuse after excuse usually having to do with how busy she is running the business.  Why we didn't just say 'forget it' then, I have no idea.  \n\nTime is wasting away - now over a month has passed - and we decide to make one final call.  By this time, we took a firm tone and told her we needed the quote that day, or we would no longer do business with her.  Guess what?  Still no quote.\n\nWe call to let her know how upset (actually, infuriated) and disappointed we are with her poor customer service.  She finally returns our call at 10:30 p.m. the next night and gives us a quote (which was 200.00 higher than the verbal quote we received two months prior).  The best part is at the end of the message she insists that we "get back to her as soon as possible" because she has to "make vacation plans."  Seriously?  Funny, because we had to make "wedding plans," but there was never any urgency on her part.  I was appalled by her nerve.\n\nThe utter lack of professionalism is shameful.  Businesses don't deserve to be successful when they are run with such poor service.
