business_id	text
58APdML-PG_OD4El2ePTvw	This is by far the most delicious brunch I have ever eaten. What a great place- from decor, to staff to drinks, to food. I am so excited to go back already! My mom and I went there early on a Saturday morning, because I was aware of the lineups later on. We both had the brunch sant! It was so much food- all fresh and delicious! The only thing I would change is to use arugula rather than plain romain lettuce.. But oh my god good good good! This is also the first place in Montreal where I have had excellent coffee... I cannot recommend this restaurant enough!!
58APdML-PG_OD4El2ePTvw	Very trendy coffee place on McGill.\nLove to go back With friends- its so beautiful inside !!!\n\nThere is the little shop at the entrane With fine and unique products.\nYou Can even take out prpared meals . they all look good !\nCoffee is de licous\nBreakfast are a sure bet!\nThey have big tables for group.
58APdML-PG_OD4El2ePTvw	Perfect breakfast spot.. not far from Old Montreal. My breakfast of scrambled eggs with cheddar cheese and asparagus was light however very filling. The eggs were cooked perfectly. We went during the week so there was no line and the staff was cordial. My husband had the le sucre, which included a raspberry crepe, blueberry brioche French toast with a side of granola and yogurt... which he enjoyed. This place also has non dairy milk alternative with their coffee, soy milk (which most places offer, but I can't stand!), coconut milk( my favorite with coffee) and almond milk.
58APdML-PG_OD4El2ePTvw	I went here for brunch with a friend at 12 on a weekday. Although we were disappointed to learn brunch is only on weekends, the lunch menu did not disappoint.\n\nWe started with the soup of the day and a delicious maple latte. For mains we split the duck and scalloped potatoes (potentially the best I've had) and the pulled pork. We finished off with a piece of deliciously moist carrot cake. Every aspect of the meal was exceptional and the restaurant has lovely vibes.\n\nCan't wait to go back for brunch!
58APdML-PG_OD4El2ePTvw	After reading the reviews I expected to be waiting at least an hour! But we got to the restaurant at 10am - minutes from our hotel at nelligan. The wait was about 5 minutes. Very busy, every seat full, but turnover seemed very quick so we were seated promptly!\n\nThey sell mimosa for early morning cures from night prior! I ordered something that sounded like eggs Benny; but they called it something else. The food was all fresh and if I am not mistaken freshly squeezed juice. The service was wonderful!  The food matched the service and ambiance was very high.\n\nHas all the excellent service which was prior provided in Toronto moved to Montreal? What a positive experience, everyone seemed happy but busy. They also have a small store front at the front of the restaurant. When we we're leaving there was a huge lineup. Glad we got there somewhat early!!
58APdML-PG_OD4El2ePTvw	Located on a broad yet quiet stretch of McGill near the Old City, Le Cartet looks like jumps straight out of the pages of a travel guide.  It's a big lofty space with crafty art pieces hanging on white brick walls, with lamps hanging down from the ceiling.  Diners are packed close together at small tables or at one of the larger communal ones.  With a small market boutique in the front and the restaurant operation in the back, it practically screams twee, but the food is good and the service is quick.\n\nAfter waiting for 20-30 minutes to sit down, I ordered the Atlantic breakfast platter, while the BF opted for the Sweet.  Both of our plates included coffee (and a mimosa for a few bucks more), as well as an avalanche of food.  My dish included scrambled eggs with smoked salmon, half a bagel dressed with lox, cream cheese, onions, and capers, a mesclun salad, fruit, and a salmon croquette, and it was more than enough.  Everything tasted really good on the whole, although the croquette was a bit dry and crusty.  His dish included crepes, french toast, fruit, and yogurt with granola.  The crepes were very good; not too sweet but just the right amount.  The french toast was not nearly as tender as I normally like (tasted a bit dry), but the subtle addition of the nuts, as well as the applesauce, added a bit of complexity.\n\nThe menu is varied enough without being overwhelming, and the vibe is very mixed.  There are young people, old people, families, couples, and singles.  Considering what we ordered, the prices are pretty reasonable.  My only complaints would be the lack space available for people to wait for tables, as well as eating in.  It also may be a bit noisy if you're trying to carry on a conversation.  But otherwise, this is a perfectly fine brunch spot with good food and a great atmosphere/scene.
58APdML-PG_OD4El2ePTvw	The food there is amazing and they have something new as daily special everyday. I had their pasta special for lunch today.
58APdML-PG_OD4El2ePTvw	Went here for an early lunch. I thought it was quite good. My bf and I ordered sandwiches - grilled chicken and a roast beef. The grilled chicken was better than the roast beef. The real star of the meal was the carrot salad. It had this unexpected ginger flavor with some dried cranberries.
58APdML-PG_OD4El2ePTvw	This place is LEGIT for brunch.\n\nMe and 3 buddies were in town for the weekend and decided to try the food on a saturday morning. The wait was too long for inside and luckily seats were opening outside which was perfect as the weather reflected our luck. \n\nThe staff were amazing, very friendly, and very helpful. But the food was the highlight here, it was insane! The portions were really big and perfect to fill our very hungry bellies. The food was really outstanding, all of our dishes were incredible, I wish this place existed for us back home.\n\nIf i'm ever back in Montreal I will surely be here for sure.
58APdML-PG_OD4El2ePTvw	Situated in Old Montral, Le Cartet offers healthy yet gourmet European style breakfast at moderate pricing.\n\nFor coffee, the restaurant uses Illy espresso, a great coffee with its roots in Italy, and my breakfast tea was from Paris, from the brand Kusmi Tea. What I found interesting and thoughtful was that the milk for my tea was frothed!\n\nThe restaurant opens at 7am and serves their breakfast until 11am. We arrived at 7:30am, and by 8 o'clock, we were very surprised to see the restaurant fully packed with a line forming at the front waiting for tables! Our advice to you is to arrive before 8am and beat the morning rush. The restaurant offers a great vibe in their loft-like space, and is a great place to bond with your colleagues or friends. If you're looking for a quick coffee, the restaurant has an open coffee bar at the front which operates much like a caf to get your caffeine fix. They also have a great selection of pre-packaged foods for a quick lunch midday, ranging from salads, yogurt bowls, pasta, and much more.\n\nI had Le Brunch Sucre. Because of its name, I expected most of my breakfast to be very sweet. To my surprise, most of the foods were sweet, but very balanced. For example, the raspberry jam on my crepe was more acidic than sweet. This is probably because they didn't add as much sugar than your generic jam company does, which provided a much refreshing taste when eaten together with the maple syrup.\n\nThe yogurt and their granola also blew me away. The granola was tasted nothing different at the beginning, but as I kept eating it with the yogurt, I found myself tasting the ginger more gradually and realized that I didn't really need the honey to sweeten it. This means a lot, from someone that loves their things, especially yogurt, sweet! The yogurt was great; it seemed very fresh, thick, and dense in consistency. It balanced everything else in the bowl very well. I saw many women ordering the yogurt bowl as part of their breakfasts, and I agree, it's a great way to start your morning!\n\nThe butter and maple syrup that the restaurant provided was quite different from the typical store-bought (or mass produced) goods as well. The butter tasted amazing, and was very light and fluffy in texture - not the hard and dense kind you see most of the time. The apple butter on the french toast was my favourite, and had to really hold myself back from buying a jar of it on my way out. It really was a perfect pairing with the french toast, and a great alternative to having your typical syrup and butter on it.\n\nOverall, I really recommend this breakfast to anyone that's looking for a sweet yet healthy option. The restaurant offers breakfast every weekday from 7am-11am, and also offers a weekend brunch both Saturday and Sunday from 9am to 3:30pm.
58APdML-PG_OD4El2ePTvw	Le Cartet a t un de nos premiers arrts lors d'une visite guide pour des invits venant de l'Autsralie. Nous y sommes all pour le brunch et en sommes resortis rassasis et satisfaits.\n\nJ'tais avec trois gars qui ont tous pris le Brunch des cantons, Un dlice pour ceux qui aiment la viande, et une occasion parfaite dcouvrir les cretons et fves aux lards  des trangers.\n\nPour ma part, le brouill aux asperges et cheddar servi sur une toast gante tait trs bien. Les fruits en accompagnement taient aussi trs bon, et non de simples garnitures pour rendre l'assiette jolie.\n\nJ'y retourne c'est granati.
58APdML-PG_OD4El2ePTvw	Le Cartet has turned me on to the deliciousness that is goat cheese in scrambled eggs, and I will be forever grateful.\n\nMy boyfriend and I decided to brunch at Le Cartet when we visited Montreal, and I really have to credit Yelp with getting us to check out this cozy spot.\n\nWhen you first arrive, you walk through the small specialty foods area. Chocolate bars of all sorts line the wall just beyond the entrance, and other fun food finds (like maple syrup, coffee and olive oil) are to your left. Looking around is a fun distraction while waiting for your table to be called, which for us took about 15 minutes. \n\nWe were seated along a long table, hip-to-hip with other diners, but that didn't bother us. I ordered the aforementioned scrambled eggs with goat cheese, which came on bread and also came with potatoes roasted in duck fat and fruit. I ordered a bagel with cream cheese, so I can could try the Montreal bagels I had heard so much about. \n\nAnd again, these eggs! Just do it! \n\nMy boyfriend got the Brunch de L'Atlantique, which includes a ramekin of scrambled eggs with smoked salmon, half of a smoked salmon bagel, a salmon and sweet potato cake, salad and fruit. Now this is a pretty breakfast! I liked the cake the best. It was very similar to a crab cake. \n\nAnd as if all of this food wasn't enough, we enjoyed mimosas and an amuse-bouche that reminded me of coffee cake. \n\nThe servers seemed experienced with getting diners through quickly -- a must considering how popular this place seems to be -- but our server was very attentive and polite at the same time. He went through the menu with us in English, and answered each question we had. \n\nHappily full after our meal, we then took more time to peruse the specialty food offerings and bought quite a few items to bring home to give to loved ones as souvenirs. Getting a great meal and some shopping done at the same time was such a nice benefit, especially considering we had only a few days to spend in this glorious city. One-stop shopping at its finest!
58APdML-PG_OD4El2ePTvw	My family and I went on a Monday morning, and it wasn't overwhelmingly busy. Had a cool edgy but modern feel. Everything on the menu seemed appetizing (making my decision quite difficult) but I ended up getting the eggs with goat milk cheese and loved it.
58APdML-PG_OD4El2ePTvw	This is one of my favorite brunch spots in Montreal, been here many times.\n\nFood: very good. Highly recommend the brunch sante. The coffee is fantastic as well, can't go wrong with most of the brunch options. Portions are just the right size and come with orange juice.\n\nService: fast and timely, staff is also very kind. Don't go too late or you'll wait a while in line, it starts getting very busy after 10.\n\nPrice: reasonable, expect around 25/pp with coffee. Worth it for the quality of food.\n\nAmbiance: hipster vibes. There are both communal tables and non communal tables, and a very cute shop in front for taking things to go.
58APdML-PG_OD4El2ePTvw	Salle agrable, service agrable, lunch agrable, prix corrects. Quatre facteurs gagnants pour y revenir manger une soupe-sandwich le midi et peut-tre un plat la prochaine fois.
58APdML-PG_OD4El2ePTvw	Pendant des annes, je travaillais dans le coin et, pendant des annes, j'y ai mang leurs repas et sandwichs prts--manger sur l'heure du lunch. C'tait aussi, d'ailleurs, mon caf de facto en rentrant au travail le matin. Sans flincher, c'est probablement un des restos les plus fiables. La qualit de leurs produits est toujours des plus leves, l'accueil en restaurant et au comptoir est toujours  la hauteur et les prix sont quand mme abordables pour le Vieux-Montral. \n\nBonnes salades, excellents sandwichs sur pain au levain maison, dlicieux plats chauds pour emporter, excellente varit de boissons et superbe slection de sucreries et chocolats locaux.
58APdML-PG_OD4El2ePTvw	Lately le Cartet has become my regular breakfast spot. I enjoy the communal table seating and the interesting art found on the walls.\n\nThe food isn't half bad either, the atlantique brunch and the soft boiled eggs are my favorite toped off with a cafe au lait in a bowl. Everything at le Cartet is good I've never heard anyone complain about the food.\n\nThe service on the other hand can be hit or miss, if one of the waiters friends happens to drop in for a coffee you could find yourself waiting for them to finish the conversation before they come take your order. \n\nAll in all Le Cartet is very nice place with good food and OK service, just remember this is old Montreal so the prices are old Montreal prices a little expensive.
58APdML-PG_OD4El2ePTvw	This lunch spot in Old Montreal looks quite unassuming from the street facade. However, the inside is quite spacious with a pleasing decor. The crowd is a mix of workers clad in business suit and trendy yuppies with plastic rimmed glasses.\n\nThe front of the restaurant also has a nice selection of takeouts, including some gourmet canned food like "Duck smoked meat". Please remember that as a great alternative the next time you have an urge to buy a "5 Dollar Foot Long" for dinner :P  \n\nThe food was quite good although I was a bit disappointed with the small size of my sandwich. My friend had the dish of the day (lamb rack served with polenta and veggies). Quite good and a good value according to him. The dessert made up for it. I tried both the Praline chocolate mousse and the Pecan pie: both delicious!\n\nit won't be my everyday lunch spot but worth a try. Expect to pay a little bit more. It's however expected considering the location.
58APdML-PG_OD4El2ePTvw	My sister and I really enjoyed Cartet in April.  If the day is nice and the wait is long, get prepared items from the shop section and picnic.  We waited just long enough for me to buy blueberry chocolate spread from the shop (AMAZING).  Brunch menu is extensive, and we both ordered huge plates with a little bit of everything.  Sister--Brunch de L'Atlantique: Eggs with smoked salmon, half a bagel with all the typical accoutrements, greens, a little sweet potato and salmon cake, and fruit. Me: Brunch de Sante--yogurt with granola and blueberries, poached eggs on greens, and grilled bread, cheddar sticks, and a fig.  And it came with coffee and juice, all for $15.  This is the kind of plate I would dream up for myself at home.
58APdML-PG_OD4El2ePTvw	My family and I walked to Le Cartet from our hotel in downtown Montreal and it was a fun experience. The space is much bigger than it appears at first with smaller tables and also family style tables. They were friendly and patient with the two year old in our group, too. The coffee was hot and rich, as was our food. \n\nThe staff couldn't have been friendlier.
58APdML-PG_OD4El2ePTvw	The 2 stars are for the rustic decoration. I have been to at least 80% of the brunch places in Montreal. I always thought that the old port was overrated and mostly a tourist trap but who am I to refuse a new brunch experience. I should have. It was very disappointing. \n1. The food was burnt and served cold. I still tried to eat it but then gave up since the potatoes and beans were dry, the bacon was stuck to the hot plate. \n2. Service was terrible. two times we had to ask for food items that were missing on our plates. Like bread and jam which is basic. No fruit salad. and no "mise-en-bouche". To top it off, when the waitress finally arrived 30 min with those items, she only brought 1 portion. at that point I was done arguing. \nI can take bad service, good food and vice versa but BOTH? no way. That was my first and last time at Cartet.
58APdML-PG_OD4El2ePTvw	Went there for brunch with friends on Saturday. I ordered the Brunch Toscan and I have never had such a stale english muffin before. The bottom was so stale that it was difficult to cut. I was super hungry, and I've used a saw before so I managed. But it was unpleasant and didn't taste very good.\n\nI left some behind to show to the waiter who seemed to just shrug it off like who cares. Super bizzare. Even McDonalds would have apologized or something. Definitely odd to have such poor quality control.\n\nHowever my friends ordered different stuff and seemed to enjoy it. So maybe some things are good here.\n\nOh and the amuse bouche to start was great, so some points for that.
58APdML-PG_OD4El2ePTvw	The salmon sandwich was a little too fishy, but the spicy chicken panini was excellent. Very cute,  minimalistic decor. Really enjoyed our overall experience. Staff is friendly and quick. Nice place for a quick lunch.
58APdML-PG_OD4El2ePTvw	I LOVE this place. Every time I visit Montreal this is a must. I also hope that it never changes. For me, this is the perfect breakfast spot. Even if there is a line, it's worth it! Everything I've ever tried has been amazing. I'm fond of the savory skillet dishes (with a free orange juice and fresh bread), but also a big fan of the crepes. It's good if you go with multiple (that was you can share!). Go hungry, leave extremely satisfied.\n\nOn the way out, don't forget to stop at the store and get some goodies to go. I opted for the Dolfin Lavender Chocolate bar. YUM!\n\nPlease open a branch in Brooklyn, NY. Pretty please?
58APdML-PG_OD4El2ePTvw	Located in old Montreal, long lineup, great atmosphere, small boutique for gourmet chocolates and teas. If you're looking for big dishes with greasy bacon and sausages, this is probably not the place for you. This resto is similar to Parisian bakeries, the croissant, baguettes and confitures- my kind of establishment. I got the brunch sant and my yogurt was soooo good, creamier French style yogurt, love it. The artisanal breads were good and overall this place is a winner for me, I like simple breakfast with great coffee.
58APdML-PG_OD4El2ePTvw	Je reviens du Cartet suite  une rencontre professionnelle. J'y ai t suite  une suggestion de plusieurs amies. Et je n'ai pas t due! \n\nLe dcor est trs  la mode et a un look professionnel. a reste tout de mme trs chaleureux avec un excellent service  la clientle et ses petites ardoises qui annoncent le menu. \n\nDe plus, il est  5 minutes du mtro Square Victoria et c'est trs facile de s'y rendre en descendant la rue McGill. \n\nJe n'y suis pas rester longtemps et j'ai bu seulement un petit caf au lait, mais c'tait exactement ce que j'avais de besoin. a mrite un beau gros 4!
58APdML-PG_OD4El2ePTvw	After reading the reviews on yelp, I walked the mile here from my hotel.  I had had a late morning and was open to eating either breakfast or lunch when I arrived.  I walked in the door at 11:15 on a Thursday.  The place was almost empty.  I sat down and the server told me that they had just ended breakfast and that they wouldn't be starting lunch for another 20 minutes.\n\nI ended up getting food to go rather than wait 20 minutes for no reason.\n\nIt's unfortunate that for some reason they can't find a way to continue to serve between meals when...well...they're a restaurant and I'm one person.\n\nThe food I got to go was decent.  So the lesson of the day is...don't walk here at 11:15.
58APdML-PG_OD4El2ePTvw	The service was good, but the food was not worth what they charge you IMO. $18+ for undercooked bacon (even though it's served on a hot cast iron skillet), hard beans, dry toast- ehhhh. The ham and sausage were good though and the complimentary bread pudding to start is nice.
58APdML-PG_OD4El2ePTvw	I need to update my rating to a five. We have been so many times now and Le Cartet is consistently awesome. Family favourite.
58APdML-PG_OD4El2ePTvw	My fiance and I made Le Cartet our first grub stop after we arrived in Montreal, starving from our long drive from New York.  The line was literally out the door, with pedestrians struggling to make their way through because hungry folks in line were blocking the wide sidewalk.  Well, despite our hunger, we figured a long line is a good sign, so we waited about 20-30 minutes to get in.\n\nWe were directed by a friendly staff into the loooooong restaurant.  The long dining tables, which I would unhesitatingly put into my own dining room, were very fitting given the restaurant's length.  Me like!  So we started off with 2 cappucinos.  I ordered the bowl after being informed of the size of the cup, and my fiance ordered the cup.  Yes, I eat like a fat person and it's quite embarrassing when my male partner's portions are smaller than my own.  Anywho, the cappucinos were creamy, frothy and smooth ... a great start to our brunch!\n\nI decided to go with the Brunch de L'Atlantique and my fiance went with Brunch des Cantons.  I love salmon so this was the perfect dish for me.  It featured a potato and salmon cake, smoked salmon over bagel and eggs with salmon, sided with salad and fruits.  My fiance's didn't appeal to me too much because I was so absorbed with my salmony meal, but his dish was by far more savory, with sausages, eggs and ham.  Both dishes came with a glass of orange juice, which really filled us up.  I left nothing but crumbs on my plate and left with a happy tummy.  Definitely worth the wait!
58APdML-PG_OD4El2ePTvw	We stopped here for brunch on the way out of a weekend in Montreal, and were blown away by the food.  I had the Brunch Sante, which featured poached eggs over shredded greens, herbed chevre and multi-grain toast. It also came with ginger granola and blueberryies over a yogurt that had the consistency of creme fraiche, some fresh fruit, aged cheddar, and a fig.\n\nMy wife had a Brunch Sucre, which included crepes, with blueberry and candied orange peel, toast topped with homemade apple-puree (almost half-way between applesauce and apple butter), and the yogurt/granola combo.  \n\nBoth brunches came to about $15 each, and included drip coffee (delicious) and orange juice.  In addition, the space is beautiful, with excellent use of wood, metal and air to provide an open environment.  \n\nWe were in a bit of a hurry, and though we never mentioned it, the food came promptly and our server was attentive.  If we hadn't been leaving the city, we would have definitely availed ourselves of the market in front, too.\n\nIf you're visiting Montreal for a weekend, it's totally worth a stop.
58APdML-PG_OD4El2ePTvw	Always enjoy going there for brunch. Expect to wait in line! but it does move.. \nWe ordered the Brunch Sante and Brunch Sucre. Never again! I had the Brunch Sucre, it was sugar over load.... in sweetness and in volume.  I do recommend sharing this plate! the wild blueberries are fantastic and the cream is not too thick. The crepes are are very good and quite dense, you may want to take a walk in the old port after. The Brunch sente was more reasonable. The granola yogurt is think and really good. I added some maple syrup to it as well .  I still have a hard time getting use to paying for a regular coffee when almost every other brunch place it's included! it's not like the price of the plate is not allowing for a free coffee :)  However they do include orange juice (still would rather the coffee).
58APdML-PG_OD4El2ePTvw	My second best brunch ever! We ordered two full plates and were not disappointed at all. I absolutely loved the poached eggs, done to perfection. Their signature granola with a 10% fat yogurt and honey was to die for! Fresh fruit and good cappuccino to top it all off.\n\nThank you to a friend who suggested this place! Highly recommended if you're in old Montreal.
58APdML-PG_OD4El2ePTvw	Came here for brunch one time.  \n\nInteresting setup here.  It's a mini-store that also serve as a restaurant.  \n\nThey have communal tables in the back where you can share with other people.  \n\nPretty wide selection for brunch, good portion, orange juice was great.\n\nPros - There was a lot of good looking boys at brunch that we stared at! :)
58APdML-PG_OD4El2ePTvw	My favourite workday lunch!  I've been here maybe a dozen times and have enjoyed every meal I've ordered so far from breakfast to lunch.   Not a big pasta fan but when I had one of their pasta dishes, I was impressed with how much I enjoyed their al dente pasta!   Pick anyone! Their soups are also good. \n\nThe staff have always been very courteous and pleasant, which is a big thing.\n\nThe reason I can't give them 5 stars is that every single time I eat there, there's always at least 1 pesky small black fly buzzing around!! It's small so not too crazy but definitely annoying to have to swat it away.  Other than that, I love the ambiance inside. It's bright and well lit, not overly noisy to allow lunch conversation.
