business_id	text
UZShf6G75npKCCjiHsf46Q	If you're looking for fresh food, I'd look elsewhere. Always have a difficult time picking out most of my fresh vegetables. Bought some fresh mozzarella the other day (about Dec 14) and when I went to eat it, I noticed the liquid had congealed and the expiry date on it was Nov 22 - how is cheese still on the shelf that's almost a month old? Deli manager told me to see him next time I was in since I had wasted $9 on that cheese and I've yet to catch him after three separate trips in a week. Went to buy some fresh basa fillets from the counter yesterday, when she put the fillet on the scale it was frozen solid... if I wanted frozen fish, I wouldn't be at the counter. The only good thing about this place is the location and they generally have good sales going on for the packaged products in the aisle and it's nice for the rewards you can collect to save money. Just be cautious of what you're buying and keep receipts to exchange product that is apparently already rotten when you get home.
UZShf6G75npKCCjiHsf46Q	This is a pretty good grocery store in a really sketchy mall. They have a PC bank machine and a Wine Rack. The produce section is one of the nicest and neatest I've seen and prices seem pretty good. I'd say it's somewhere between a No Frills and a Loblaws. I wasn't looking for any of my staples, though, so I can't say what the pricing is like. \n\nParking is plentiful, but it's kind of hard to get out of the lot when it's rush hour, and you're a slave to the light.
LLNmo66wO1xoi-yma1HybA	Initially Hyde Out seems pretty promising - the decor is pretty spectacular, and the cocktail menu is interesting and extensive. The food menu also seems a bit more upmarket than most else on offer in the area.\n\n\n However, I've been a few times now and it doesn't seem to quite live up to it's initial impression. Each time I've ordered a cocktail only to be told that they can't make it as they have run out of a crucial ingredient. Similarly, my second choice drinks have been made with poor substitutes - Zubrowka with cheap apple juice is not the same as with cloudy pressed apple juice. For a bar that is trying to promote itself as a notch above the competition this seems a bit shoddy.\n\n\n The food is similarly hit and miss - the chunky chips were actually shoestring fries. Not bad in itself but it's annoying to order one thing and receive another. Bread and dips contains a huge loaf of bread, but about 2tbsp of pesto and balsamic to dip it in. We asked for more dips and received another incredibly stingy portion that disappeared in 2 or 3 dunks. The bread had been toasted on the outside, but was still a bit frozen on the inside.\n\n\n Hyde Out has only been open a few weeks, so I'll give them the benefit of the doubt for now and put it down to teething problems. It's certainlymy favourite bar in that area at the moment, but then given the competition that's not saying much. Fountainbridge isn't a top spot for passing traffic, so they'll need to improve their act if they want to become a destination bar and survive.\n\n\n Plus their website is awful - again, lots of room for improvement! http://www.hydeout.co.uk/
LLNmo66wO1xoi-yma1HybA	Finally reviewing this place, as after a 4 month wait, following a disastrous afternoon tea experience, the management still haven't had the decency to make good on their offer of a replacement.\nThe tea was bought as an internet deal, promosing a 'luxury afternoon tea'. It was anything but & prompted complaints from a couple sat next to us. \n\nThe waitress was very friendly (the only good thing about the place), but the manager seemed extremely put out by the fact that someone had challenged what they were offering. \n\nIn fact it was the worst meal out, afternoon tea or not, that I've ever had. There was so little of it & even then the quality was poor.\nUpon making an email complaint, I was sent an apologetic (though I see now that it was just sarcastic, as I've tried another 2 times, with another 'manager' there) email offering me a replacement meal, with cocktails. This has never materialised, nor have I been contacted again.\nI could not recommend this place, for food or drinks, as the service is absloutely dreadful. Avoid at all costs.
LLNmo66wO1xoi-yma1HybA	I like the look/decor of this bar, it looks like it could be really cool. It's hidden away so people generally don't know about it. It's close to Cargo which more people would know of as it faces onto a main road. It has the potential to be a great bar but it's lacking something, which I can't quite put my finger on. I've been there twice now and it has been fairly empty each time. I ordered wine and it seemed extremely expensive though I'm not sure what the prices of other drinks were. There's plenty of bars with better atmospheres around this area that I would prefer to go to.\n\nMyself and a friend were going to book the upstairs bar for our birthdays before, but it was going to be very expensive and they wouldn't accept card upstairs so people would have had to go downstairs unless they had cash. I don't know why bars do this.
LLNmo66wO1xoi-yma1HybA	This place is all suits and short skirts, so if that's what you're after it's an alright choice. \n\nMeeting the OH here the other night I was a bit apprehensive as I had always pegged it for a student bar. I was surprised to find a bit of an older crowd (older than undergrads anyway) and the place wasn't too jammed for a Friday night.\n\nA well stocked bar, a decent cocktail menu and a pool table make me think I should make more use of the place but the swirly decals and wacky colour scheme make me think otherwise. \n\nIt's basically a brighter Cargo with less sports on the telly.
LLNmo66wO1xoi-yma1HybA	Had great drinks here the other night. Best thing, it seems, is to ask the staff to make a new drink- they know their stuff, plus they've got a pretty big selection to choose from. Heard someone say it was expensive, but at 6.50 for a decent cocktail on a friday night in a George St-esq place, I can't complain. Such a better alternative to Cargo.
LLNmo66wO1xoi-yma1HybA	hmm this is a rather interesting place.  tucked away behind cargo overlooking the canal basin and office buildings, it's probably not the most popular venue for a night out.  in fact being hidden away i'm not sure that people are totally aware that this place exists which may be a bit of a shame.  the bar is all decked out in dark velvet colours and dark wood tables with stylish wallpaper accents so it's clear that this is trying to mimic the posh bars on george street but somehow it misses the mark.  the space is all modern with windows floor to ceiling on both sides which somehow makes it lack atmosphere when there are so few people having drinks.\n\ni can't say overly much for the service either.  i was at a private party in the upstairs bar and while there was a good number of people i would hardly say that the one girl behind the bar was over run.  that said when i went to order a lime and soda she acted like she was sooooooo busy and this was a waste of her time although i was the only person stood at the bar ordering.  also when my boyfriend tried to pay for a bottle of champange by card he was told he'd have to go downstairs to do this but the girl didn't seem to want to print out the receipt so he could actually pay for the bubbles.  additionally when we had been downstairs earlier in the night (probably around 8pm) to try to order some food we were told that the kitchen was closed and we couldn't.  um what???  we could clearly see into the kitchen and there was a cook there who appeared to be making food... not sure why we were turned down but it was their loss as zizzi got our custom instead.\n\nso overall i wasn't overly impressed with the bar.  it's trying hard but at the same time the staff aren't trying hard at all.  the posh decor should make it a nice place to drink, but it just totally lacked any atmosphere and didn't leave any impression that would make me want to return again.  bit of a shame as with some many financial businesses having their offices nearby this would be an ideal place for an after work drink, but i think with less than friendly bar staff and a cold environment most people will opt for the bars on george street instead.
58APdML-PG_OD4El2ePTvw	This is our favourite place to grab breakfast in Montreal and we come back every time we are in Old Montreal. Best latte I've ever had and the food is fantastic. Service is friendly and professional and really fast. Great vibe as well. It gets quite loud in there, but I love some loud and animated conversation to go along with a fabulous meal.\n\nBe ready to wait in line if you go on Saturday or Sunday, but the line moves fairly quickly and I don't mind waiting in line for great food!
58APdML-PG_OD4El2ePTvw	Wonderful breakfast!  I enjoyed the goat cheese scrambled eggs on toast.  The eggs were light/fluffy and the goat cheese had a great flavor.  The decor of the restaurant is rustic modern and had a warm feel.  It was also nice that there was free wifi and they serve illy coffee.
58APdML-PG_OD4El2ePTvw	Sunday Brunch Spectacular- had Brunch Cartet which was a plate of scrambled egg, salad, cheese, salmon cake (amazing!), and ham croissant. Show stealer: croissant. So good. Not too flaky but not not too solid either, wasn't too salty or too sweet, simply perfect. Probably the best croissant in montreal. I had the ham removed because i don't eat pork so my croissant came just with cream cheese but I'd rather have nothing on it and just go for plain croissant. I cannot stop fawning about how great the texture and softness of the croissant was. Next time I come, I'm simply getting a good ol' croissant avec cafe.\n\nEverything else was great too but honestly the croissant was so good that the rest pales down to it. I also had a latte (they use beans by illy) which was also a rich and smooth blend of milk and coffee, not too bitter. Definitely recommend. All brunch plates also come with bread pudding (not my fav) and (super-duper) fresh orange juice.\n\nBest part is the location, situated south of downtown, in the heart of a non-touristy part old port. It's like walking into a perfect life and having your dreams fulfilled in cup of coffee. Great ambience and had a great experience.\n\nP.s. hot waiters ;)
58APdML-PG_OD4El2ePTvw	Excellent and unique brunch. Good ambience. Lines could be little long but they move it fast. We had the salmon and the ham croissant.
58APdML-PG_OD4El2ePTvw	If there's one thing that I've noticed so far about the Old Port food scene, it's that it tends to be a 50/50 toss up between quality cuisine and overpriced tourist traps. Le Cartet fits more into the first category with a bit of the price factor of the latter. Located in a nice part of the area, it has an open and aesthetically pleasing layout to go along with the food served, a plus that never hurts.\n\nI ordered the "Le Nordique" platter and a maple latte to go along with it. The maple latte, while it didn't have too much of a coffee taste to it, tasted delightful in regards to the quality of the maple flavoring without being overbearingly sweet. The Nordique platter consisted of a smoked salmon Eggs Benedict on a base of some type of black bread, a side salad, and some roasted potatoes. Raw onions garnished the Eggs Benedict, which I picked out since I absolutely detest them, but other than that they it was a really yummy dish. The bread base was also quite amazing and tasted more wholesome than your generic English muffin/white bread. The potatoes were perfectly crisp and seasoned so that they didn't taste bland like how potatoes often become, and the salad had a nice, light dressing to go along with it. The only issue that I had with the dish was that for $15.50, it seemed a bit pricey for how much food they gave, even though it was presented nicely. \n\nLe Cartet is definitely a great place if you want to enjoy a nice brunch in a chic environment. I would save it for occasions that lean more toward the special side, however, unless you have enough dough to spend on a regular basis (which as a university student I do not have, unfortunately).
58APdML-PG_OD4El2ePTvw	Charming breakfast / brunch place in the old port but expensive for what you are getting.\nUsually a wait as well which brings it down on my list of recommendations
58APdML-PG_OD4El2ePTvw	I came here for breakfast/brunch on a Thursday. No line up or crowd which was nice. I ordered the smoked salmon scrambled eggs with black toast and a glass of freshly squeezed orange juice - which btw wasn't squeezed by the restaurant. The food was okay. I think it's a little overrated for what you get and for the price. I don't really get what the hype is all about. I've had better breakfast/brunch elsewhere. On a high note, the vanilla latte was spot on however it would have been nice if they did a little swirly graphic with the milk froth but they didn't. Service was meh.\n\nOverall, I probably wouldn't come back again any time soon. I think there are many other restaurants to try before I return again for my vanilla latte.
58APdML-PG_OD4El2ePTvw	Delicious! Love the ambience also. The iced vanilla latte is great. Had the orange juice which was amazing; I wish the glasses were bigger though. Had the brunch sant and it felt health while also tasty.
58APdML-PG_OD4El2ePTvw	I was in Montreal for 24hrs with my boyfriend, and while visiting the old city, we decided to have lunch here. \n\nThe street is pretty, with lots of other restaurants, but somehow we picked this one because of its window with all different products and the big common tables you can see from outside. Such a perfect choice! \n\nThe atmosphere is lovely. All waitress and I am assuming the owner are ladies, dress in black, super nice. We ordered their lunch specials of sandwich and soup/salad, which came also with fresh bottle of water (free as well as their refills), and bread with butter. \n\nThe soup was delicious, served inside a tiny pot. My sandwich was amazing, with tons of salmon in it. My boyfriend had a more regular baguette one, but really full of ingredients, with a side of colorful tasty original salad. \n\nWe really enjoyed, and I suggest this gem to everyone who is visiting the old city! Also, free speedy wifi, and cool crowds.\nThank you Le Cartet!
58APdML-PG_OD4El2ePTvw	Waiting time is a bit long on this Sunday morning (expected I guess) but the brunch plates are worse it! Fresh orange juice and amazing "latte with maple syrup"!! Must come back and try all the other dishes.
58APdML-PG_OD4El2ePTvw	Food & Drink\n- I always get a benedict or poached egg dish for breakfast, brunch here was no different. The eggs were poached perfectly just the way I like them. \n- They don't use hollandaise sauce on the benedict, which I would have preferred, but their sauce was also nice and creamy, but not the taste I'm used to. \n- A side of fruit and potatoes are included - but not much as the benedicts are pretty heavy in themselves. The potatoes are cooked in duck fat and taste divine. \n- The benedict comes with a fresh glass of OJ, I LOVE FRESHLY SQUEEZED OJ!!\n- Latte was good\n\nService\n- The service was great from beginning to end\n- The waiters were very busy, but came by to check on us at all the right times. We never felt rushed.\n- The waiters made sure food and drinks came to use in a timely manner after we ordered.
58APdML-PG_OD4El2ePTvw	Ambience is great! It wasn't busy and it felt like a great place to sit and do some work for a couple hours\n\nFood was eh. I got the brunch cartet and while tasty, was more like a bunch of random things thrown on the plate.
58APdML-PG_OD4El2ePTvw	This was the very first restaurant I came to upon my arrival in beautiful Montreal. My sister said it was a good breakfast spot and she was right! I ordered a BLT bagel and my sister had the Brunch Sante dish (which came with granola & yogurt, fruit, poaches eggs, cheese, etc.). I really enjoyed this quaint little caf; it was cozy, had great service, and a wonderful ambiance that made me feel like I was in a different country... oh wait, I was! Anyway, this was a great place to kick off my vacation and get breakfast. If I lived nearby, I can totally see myself coming here regularly.
58APdML-PG_OD4El2ePTvw	Having worked for a year in the Cit Multimdia, Le Cartet was a go-to for lunch time when I had to grab a take-out. I especially love their 'epicerie' style section, where they offer a nice variety of chips and snacks, imported European products (that wasabi mayonnaise I found there, amazing!), and a nice take-out dishes that you could grab and bring back to your office. \n\nThe downside of it? It can get pricey, and it's crowdy since it's sooooo popular during lunchtime.
58APdML-PG_OD4El2ePTvw	Le Cartet is one great place to try for breakfast with their interesting concept of boutique restaurant. Plus, they offer a wide range of products such bottled smoothies, sandwiches, salads, pastries and more. \n\nLaid-back crowd, cozy ambiance and delicious food. What can you ask for more? If the weather is great, you can even sit outside. This place definitely get off the beaten track.
58APdML-PG_OD4El2ePTvw	Despite there being lots of people waiting, we got a seat outside with the dog within about 5 minutes, both times we went here. The big fry-up was incredible, and the healthy breakfast was delicious. The service was fast and friendly, and they even brought out a bowl of water for the dog.
58APdML-PG_OD4El2ePTvw	Came here originally for breakfast but unfortunately it ended by 11am. I got there at 1111am so I had to wait around 10-15 minutes for the kitchen to prepare their brunch/lunch menu. \nI ordered the vegetarian panini with their soup of the day. It was delicious and well presented. \nDefinitely one of my favourite brunch places in Montreal. Located in a lovely area as well. \nStaff are really friendly and hospitable.
58APdML-PG_OD4El2ePTvw	This restaurant was great. The food was amazing (a bit expensive, I paid 17$ for the ptes du jour), but it was delicious. It is located in a beautiful spot, the restaurant and the restrooms are very clean and look quite nice. The service was amazing!!! The waitress was sooooo sweet!
58APdML-PG_OD4El2ePTvw	Ce restaurant est class depuis 3 ans dans le guide mixeur comme tant une des cuisines les plus cratives de Montral. Pourtant, depuis 3 ans, je lis leur menu et a ne m'intresse pas vraiment. \n\nJ'y suis alle au dbut de la semaine avec 5 amis et j'ai bien aim. Les sandwichs sont dlicieux et savoureux. Chaque pain est servi dans un sandwich qui lui est propre et qu'il est impossible d'interchang (ce que je trouve un peu dommage. Seule exception: pour du pain sans gluten). Les plats du jour sont simples, mais apparemment dlicieux aussi. \n\nLa boutique de produits fins  l'entre est intressante, l'ambiance et le dcor du restaurant aussi. On retrouve de grandes tables  partager avec des banc en bois ainsi que des petites tables avec des chaises. Les murs sont dcors de faon trs artistiques et les petites lampes pendant du trs haut plafond apportent beaucoup de cachet. \n\nLe service est gentil, mais peu prsent.\n\nAu cartet, on ne rvolutionne pas le monde, mais on fait bien les choses. J'y retournerai pour essayer les djeuners servis tous les jours qui avaient l'air particulirement cochon.
58APdML-PG_OD4El2ePTvw	Great breakfast place with delicious coffees, juices, and breakfast specialties.  Croissants were flakey, hot breakfasts were yummy and service was friendly and fast.  On weekends will require a wait, but there is a charming shop up front with a selection of gourmet items from all over the world.  Nice ambiance with high ceilings and exposed brick walls.   Local crowd.
58APdML-PG_OD4El2ePTvw	Pros: Beautiful setting, Delicious& Fresh food, Great service\nCons: Possible wait times, Food baby inducing, Busy\n\n-Ambiance- \nVery nice place to have weekend brunch, a lot of sunshine and open windows perfect to cure that night before hangover.  There is seating outside at the front and inside the restaurant as well as a quaint section selling treats at the front. Our server was phenomenal and was very enthusiastic throughout the whole service; explaining items and catering to all of our particular food needs.  Food ranges from 5-25$.\n\n-Food- \nCoupe Sant:  Yoghurt+ Granola+ Fruits. Ordered this to keep it light and I was very much satisfied. The fruits were fresh and varied,  the granola was in-house made  and still warm, and the yogurt was light and creamy. What more can you ask for. \n\nTrois Minutes: Two soft-boiled eggs with bio toast, duck fat potatoes, fresh fruit and jam.  Straightforward plate with quality ingredients. We also got the organic peanut butter, which was god-sent. \n\n-Overall- \nGo for weekend brunch don't be health conscious pansies like us and get the big brunch plates. Enjoy delicious&fresh food in a beautiful setting with good company.
58APdML-PG_OD4El2ePTvw	Went here for breakfast twice during a 2 day stay in Montreal. The food was absolutely fantastic and the ingredients were very fresh. Everything was arranged on the plate with many different components each adding their own flavor and contribution to the overall meal. \n\nI would definitely go to this place again if I happen to find myself in this great city.
58APdML-PG_OD4El2ePTvw	Amazing and authentic food served in a really appealing cast iron skillet still sizzling. There was no wait for us and the service was great. I also highly recommend the maple croissants.
58APdML-PG_OD4El2ePTvw	I ordered the brunch cartet and my frend ordered brunch sucre. They are really yummy!! The smoothie of the day is great. But we couldn't not finish them. For girls, you can order two brunches for three or even one for two persons :(\n\nBut the environment was too noisy I cannot hear my friend talking
58APdML-PG_OD4El2ePTvw	Had their salmon tartar plate! Nice vibe and little boutique products right at the entrance! :)
58APdML-PG_OD4El2ePTvw	Great ham & cheese baguette though not much for my husband (vegetarian). Excellent selection of chocolate bars inside, and I am regretting that I didn't order a chocolate dessert, they looked amazing!
58APdML-PG_OD4El2ePTvw	I had a couple of nice brunches there with friends. Tried the sweet dish and the savory dish, the crusty crunchy toast and de awakening coffee. Will go back there again for its communal seating and of course the food.
58APdML-PG_OD4El2ePTvw	Delicious.  Variety.  Well prepared and presented.  From the light to the massive the breakfasts are plenty satisfying.  Love the space too - individual as well as long shared tables and the high ceilings make for a pleasant time.
58APdML-PG_OD4El2ePTvw	Again, the yelp posting says its "Good for Kids: Yes" and I disagree slightly.  It's probably good for kids who can sit in their own seat and not in a high chair.  If you have a kid who needs a high chair, I would probably bring your own food for him/her.  The high chair that they brought was a bit disgusting. They obviously do not clean their high chairs every night. We were one of the first when they opened so it's not like tons of other kids used it before we got there.  Also the choices are few and far between for a one year old. There are no waffles, pancakes, or anything of that sort.\n\nWIth that being said, my quiche was tasty and was accompanied by a lovely side salad.  The coconut banana bread was also very yummy, not too sweet and not too coconutty.  My husband ordered the crab extravaganza - crab benedict, crab cakes, and some other crab item.  All were tasty.\n\nOur waiter was a bit stand-offish. I speak french but decided to speak english here and I felt like I paid for it. The waiter was unaccomodating, didn't smile, and ignored us.  We had to wave him down everytime we needed something. It's unfortunate. There was another waiter who stopped by to say hello to my daughter who was very sweet so I don't think all of their staff is half-bad.\n\nI would go back for sure...for the food and when my daughter is older!
58APdML-PG_OD4El2ePTvw	Fabulous breakfast/brunch joint. Modern/classy but casual full service cafe/restaurant with small store and takeout near entrance. Gets pretty packed after 10 am weekends. Love the wooden communal tables and the loft style ceilings. Portions are perfect and the coffee is excellent. Great service. Great clean modern dcor.
58APdML-PG_OD4El2ePTvw	Had a poached egg and duck brunch. \nThe plate was exquisite, service was top notch and the ambiance was excellent. \n\nJust what the doctor ordered. And everyone that works here is a professional. That's quite rare. \n\nTo top it off, the quality you get for the price is probably unique in MTL for breakfast/brunch. \n\nHealthy and more more decadent options are available, the coffee is great and the staff is friendly. \n\nPosted this while still seated. \n\nMust try.
58APdML-PG_OD4El2ePTvw	Loved brunch here! Not alot of selection but you sure get the most for your buck!\n\nI got the smoked salmon dish. All was great except for the sweet potato salmon ball. \n\nStaff were very friendly. Would definitely recommend.
58APdML-PG_OD4El2ePTvw	Chic, high ceilinged place with a nice looking clientele and excellent food for those who do, and those who do not, like duck fat. They also have very nice take out plates and gift items at the front of the shop.
58APdML-PG_OD4El2ePTvw	As an infrequent visitor of Montreal, Le Cartet is one of my favorite restaurants for breakfast and brunch. Such wonderful food that I think is healthful but doesn't taste like health food.  Despite the bustling flow of people through the place, the staff remains enjoyable.  Love love love this place and wish we had one here in New York!
